InvoiceNo,StockCode,Description,Quantity,InvoiceDate,UnitPrice,CustomerID,Country
538093,22197,SMALL POPCORN HOLDER,12,2010-12-09,0.85,12682.0,France
552826,21161,KEEP OUT BOYS DOOR HANGER ,24,2011-05-11,1.45,14277.0,France
539453,72598,SET/12 TAPER CANDLES,4,2010-12-17,1.66,,United Kingdom
547910,22068,BLACK PIRATE TREASURE CHEST,2,2011-03-28,1.65,14159.0,United Kingdom
564089,21931,JUMBO STORAGE BAG SUKI,50,2011-08-23,2.08,15971.0,United Kingdom
579536,22211,WOOD STAMP SET FLOWERS,12,2011-11-30,0.83,12957.0,United Kingdom
573038,21163,DO NOT TOUCH MY STUFF DOOR HANGER ,2,2011-10-27,0.39,17545.0,United Kingdom
537192,21623,VINTAGE UNION JACK MEMOBOARD,1,2010-12-05,9.95,16402.0,United Kingdom
578041,22326,ROUND SNACK BOXES SET OF4 WOODLAND ,1,2011-11-22,2.95,17338.0,United Kingdom
545698,22293,HANGING CHICK GREEN DECORATION,1,2011-03-06,1.45,15572.0,United Kingdom
547362,21918,SET 12 KIDS COLOUR  CHALK STICKS,576,2011-03-22,0.36,13694.0,United Kingdom
562417,22469,HEART OF WICKER SMALL,20,2011-08-04,3.29,,United Kingdom
544795,84968D,SET OF 16 VINTAGE RED CUTLERY,1,2011-02-23,12.75,15858.0,United Kingdom
545658,22748,POPPY'S PLAYHOUSE KITCHEN,1,2011-03-04,2.1,14670.0,United Kingdom
550458,22278,OVERNIGHT BAG VINTAGE ROSE PAISLEY,1,2011-04-18,10.79,,United Kingdom
572549,21408,SPOTTY PINK DUCK DOORSTOP,1,2011-10-24,8.29,,United Kingdom
579408,21832,CHOCOLATE CALCULATOR,1,2011-11-29,1.65,14701.0,United Kingdom
541516,21803,CHRISTMAS TREE STAR DECORATION,1,2011-01-18,0.42,,United Kingdom
540238,21992,VINTAGE PAISLEY STATIONERY SET,2,2011-01-05,2.51,,United Kingdom
557283,22382,LUNCH BAG SPACEBOY DESIGN ,2,2011-06-19,1.65,16813.0,United Kingdom
540768,22956,36 FOIL HEART CAKE CASES,48,2011-01-11,1.85,17428.0,United Kingdom
573286,22333,RETROSPOT PARTY BAG + STICKER SET,1,2011-10-28,1.65,,Switzerland
567368,23073,GEORGIAN TRINKET BOX,2,2011-09-20,12.5,17147.0,United Kingdom
536544,22792,FLUTED ANTIQUE CANDLE HOLDER,2,2010-12-01,1.66,,United Kingdom
573151,85049A,TRADITIONAL CHRISTMAS RIBBONS,4,2011-10-27,1.25,17602.0,United Kingdom
580021,23206,LUNCH BAG APPLE DESIGN,10,2011-12-01,1.65,14047.0,United Kingdom
580115,22712,CARD DOLLY GIRL ,1,2011-12-01,0.83,,United Kingdom
553219,21181,PLEASE ONE PERSON METAL SIGN,12,2011-05-16,2.1,13769.0,United Kingdom
573178,85199S,SMALL HANGING IVORY/RED WOOD BIRD,24,2011-10-28,0.42,14412.0,United Kingdom
562377,23032,DRAWER KNOB CRACKLE GLAZE IVORY,6,2011-08-04,1.65,14535.0,United Kingdom
581335,22446,PIN CUSHION BABUSHKA PINK,12,2011-12-08,1.25,15214.0,United Kingdom
541862,47580,TEA TIME DES TEA COSY,4,2011-01-23,2.55,14068.0,United Kingdom
580260,21875,KINGS CHOICE MUG,6,2011-12-02,1.25,14085.0,United Kingdom
556081,21929,JUMBO BAG PINK VINTAGE PAISLEY,1,2011-06-08,4.13,,United Kingdom
550272,22375,AIRLINE BAG VINTAGE JET SET BROWN,1,2011-04-15,4.25,18079.0,United Kingdom
546643,22624,IVORY KITCHEN SCALES,2,2011-03-15,8.5,16214.0,United Kingdom
551734,20970,PINK FLORAL FELTCRAFT SHOULDER BAG,4,2011-05-04,3.75,18178.0,United Kingdom
560203,22468,BABUSHKA LIGHTS STRING OF 10,1,2011-07-15,6.75,15311.0,United Kingdom
578233,21901,"KEY FOB , BACK DOOR ",1,2011-11-23,0.65,14049.0,United Kingdom
571682,15056BL,EDWARDIAN PARASOL BLACK,1,2011-10-18,5.95,14179.0,United Kingdom
553162,20731,POSY CANDY BAG,2,2011-05-13,0.83,,United Kingdom
557598,22853,CAT BOWL VINTAGE CREAM,1,2011-06-21,3.25,14667.0,United Kingdom
565401,22076,6 RIBBONS EMPIRE  ,5,2011-09-02,1.65,16686.0,United Kingdom
558904,35653,VINTAGE BEAD NOTEBOOK,1,2011-07-04,2.46,,United Kingdom
560853,21672,WHITE SPOT RED CERAMIC DRAWER KNOB,2,2011-07-21,1.25,15311.0,United Kingdom
554929,84950,ASSORTED COLOUR T-LIGHT HOLDER,12,2011-05-27,0.65,13018.0,United Kingdom
564572,22386,JUMBO BAG PINK POLKADOT,10,2011-08-26,2.08,15078.0,United Kingdom
568716,22585,PACK OF 6 BIRDY GIFT TAGS,1,2011-09-28,2.46,,United Kingdom
548715,20686,DOLLY MIXTURE CHILDREN'S UMBRELLA,4,2011-04-03,3.25,17758.0,United Kingdom
581125,22210,WOOD STAMP SET BEST WISHES,8,2011-12-07,0.83,14087.0,United Kingdom
563933,22736,RIBBON REEL MAKING SNOWMEN ,6,2011-08-21,1.65,16536.0,United Kingdom
550500,22285,HANGING HEN ON NEST DECORATION,1,2011-04-18,3.29,,United Kingdom
538076,21259,VICTORIAN SEWING BOX SMALL ,1,2010-12-09,5.95,15311.0,United Kingdom
556093,22195,LARGE HEART MEASURING SPOONS,1,2011-06-08,3.29,,United Kingdom
569700,84993A,75 GREEN PETIT FOUR CASES,1,2011-10-05,0.83,,United Kingdom
564753,23165,LARGE CERAMIC TOP STORAGE JAR,12,2011-08-30,1.65,13709.0,United Kingdom
561356,21707,FOLDING UMBRELLA BLACKBLUE POLKADOT,4,2011-07-26,4.95,14273.0,United Kingdom
574023,20668,DISCO BALL CHRISTMAS DECORATION,24,2011-11-02,0.12,14390.0,United Kingdom
561877,23200,JUMBO BAG PEARS,2,2011-07-31,2.08,16401.0,United Kingdom
578270,22698,PINK REGENCY TEACUP AND SAUCER,2,2011-11-23,5.79,14096.0,United Kingdom
580619,79066K,RETRO MOD TRAY,1,2011-12-05,0.85,15053.0,United Kingdom
569401,22960,JAM MAKING SET WITH JARS,6,2011-10-04,4.25,15111.0,United Kingdom
573913,22423,REGENCY CAKESTAND 3 TIER,2,2011-11-01,12.75,17653.0,United Kingdom
579938,23356,LOVE HOT WATER BOTTLE,3,2011-12-01,5.95,14146.0,United Kingdom
549982,21928,JUMBO BAG SCANDINAVIAN BLUE PAISLEY,10,2011-04-13,2.08,17091.0,United Kingdom
554139,22983,CARD BILLBOARD FONT,12,2011-05-23,0.42,14911.0,EIRE
540551,85014B,RED RETROSPOT UMBRELLA,1,2011-01-10,12.72,,United Kingdom
580909,22083,PAPER CHAIN KIT RETROSPOT,6,2011-12-06,2.95,18225.0,United Kingdom
544888,22697,GREEN REGENCY TEACUP AND SAUCER,6,2011-02-24,2.95,14231.0,United Kingdom
567183,22107,PIZZA PLATE IN BOX,2,2011-09-18,3.75,14769.0,United Kingdom
562213,23301,GARDENERS KNEELING PAD KEEP CALM ,2,2011-08-03,1.65,13975.0,United Kingdom
579297,23241,TREASURE TIN GYMKHANA DESIGN,1,2011-11-29,4.13,,United Kingdom
542609,71038,WHITE HANGING BEADS CANDLE HOLDER,2,2011-01-30,5.45,13161.0,United Kingdom
C564913,23174,REGENCY SUGAR BOWL GREEN,-1,2011-08-31,4.15,12560.0,Germany
C574493,23436,VINTAGE CHRISTMAS GIFT BAG LARGE ,-3,2011-11-04,1.25,14842.0,United Kingdom
546654,21035,SET/2 RED RETROSPOT TEA TOWELS ,1,2011-03-15,6.25,,United Kingdom
575748,20724,RED RETROSPOT CHARLOTTE BAG,54,2011-11-11,2.46,,United Kingdom
539453,85132A,CHARLIE + LOLA BISCUITS TINS,1,2010-12-17,8.47,,United Kingdom
556280,22295,HEART FILIGREE DOVE LARGE,6,2011-06-09,1.65,14584.0,United Kingdom
555325,21557,SET OF 6 FUNKY BEAKERS,1,2011-06-02,5.63,,United Kingdom
550255,22465,HANGING METAL STAR LANTERN,12,2011-04-15,1.65,13468.0,United Kingdom
578846,84006,MAGIC TREE -PAPER FLOWERS,5,2011-11-25,0.85,17757.0,United Kingdom
570103,23199,JUMBO BAG APPLES,6,2011-10-07,2.08,15719.0,United Kingdom
558862,23021,GLASS BONNE JAM JAR,4,2011-07-04,4.15,13901.0,United Kingdom
541485,22525,CHILDRENS GARDEN GLOVES PINK,1,2011-01-18,1.25,18118.0,United Kingdom
542240,22847,BREAD BIN DINER STYLE IVORY,2,2011-01-26,16.95,16124.0,United Kingdom
540554,85180B,PINK HEARTS LIGHT CHAIN ,12,2011-01-10,1.25,18171.0,United Kingdom
563367,22961,JAM MAKING SET PRINTED,12,2011-08-16,1.45,16133.0,United Kingdom
557494,75049L,LARGE CIRCULAR MIRROR MOBILE,1,2011-06-20,2.46,,United Kingdom
556179,21500,PINK POLKADOT WRAP ,25,2011-06-09,0.42,13756.0,United Kingdom
569832,21802,CHRISTMAS TREE HEART DECORATION,36,2011-10-06,0.42,15315.0,United Kingdom
566200,21985,PACK OF 12 HEARTS DESIGN TISSUES ,12,2011-09-09,0.39,16910.0,United Kingdom
C541245,85036C,ROSE 1 WICK MORRIS BOXED CANDLE,-12,2011-01-16,4.25,15535.0,United Kingdom
541569,POST,POSTAGE,3,2011-01-19,40.0,13520.0,Switzerland
556781,21908,CHOCOLATE THIS WAY METAL SIGN,12,2011-06-14,2.1,13384.0,United Kingdom
564660,22271,FELTCRAFT DOLL ROSIE,6,2011-08-26,2.95,15074.0,United Kingdom
536796,22350,ILLUSTRATED CAT BOWL ,1,2010-12-02,2.55,15574.0,United Kingdom
537823,22064,PINK DOUGHNUT TRINKET POT ,7,2010-12-08,3.36,,United Kingdom
540907,21868,POTTING SHED TEA MUG,12,2011-01-12,1.25,13488.0,United Kingdom
558707,21088,SET/6 FRUIT SALAD PAPER CUPS,2,2011-07-01,0.19,12748.0,United Kingdom
565854,21936,RED RETROSPOT PICNIC BAG,10,2011-09-07,2.95,12490.0,France
563448,21506,"FANCY FONT BIRTHDAY CARD, ",12,2011-08-16,0.42,15220.0,United Kingdom
572125,23480,MINI LIGHTS WOODLAND MUSHROOMS,8,2011-10-21,3.75,16156.0,United Kingdom
556243,21731,RED TOADSTOOL LED NIGHT LIGHT,1,2011-06-09,3.29,,United Kingdom
566869,20728,LUNCH BAG CARS BLUE,10,2011-09-15,1.65,13658.0,United Kingdom
550301,82484,WOOD BLACK BOARD ANT WHITE FINISH,4,2011-04-17,7.95,17243.0,United Kingdom
568798,22314,OFFICE MUG WARMER CHOC+BLUE,6,2011-09-29,2.95,12615.0,France
544766,21931,JUMBO STORAGE BAG SUKI,1,2011-02-23,4.13,,United Kingdom
579414,22086,PAPER CHAIN KIT 50'S CHRISTMAS ,2,2011-11-29,2.95,14719.0,United Kingdom
556915,22582,PACK OF 6 SWEETIE GIFT BOXES,1,2011-06-15,2.55,15036.0,United Kingdom
543737,22414,DOORMAT NEIGHBOURHOOD WITCH ,4,2011-02-11,7.95,12477.0,Germany
577768,23508,MINI PLAYING CARDS DOLLY GIRL ,1,2011-11-21,0.83,,United Kingdom
565224,22633,HAND WARMER UNION JACK,4,2011-09-01,2.1,14713.0,United Kingdom
556932,23344,JUMBO BAG 50'S CHRISTMAS ,1,2011-06-15,4.13,,United Kingdom
548740,22089,PAPER BUNTING VINTAGE PAISLEY,6,2011-04-04,2.95,13319.0,United Kingdom
545215,22550,HOLIDAY FUN LUDO,1,2011-02-28,7.46,,United Kingdom
578067,22982,PANTRY PASTRY BRUSH,1,2011-11-22,2.46,,United Kingdom
538942,82001S,VINYL RECORD FRAME SILVER,1,2010-12-15,3.75,17346.0,United Kingdom
572913,22549,PICTURE DOMINOES,3,2011-10-26,1.45,15993.0,United Kingdom
547250,21175,GIN + TONIC DIET METAL SIGN,1,2011-03-22,4.96,,United Kingdom
577695,23321,SMALL WHITE HEART OF WICKER,3,2011-11-21,1.65,15645.0,United Kingdom
581217,21983,PACK OF 12 BLUE PAISLEY TISSUES ,2,2011-12-08,0.83,,United Kingdom
561388,22907,PACK OF 20 NAPKINS PANTRY DESIGN,96,2011-07-27,0.72,12753.0,Japan
548698,47480,HANGING PHOTO CLIP ROPE LADDER,2,2011-04-03,1.65,18109.0,United Kingdom
549789,20726,LUNCH BAG WOODLAND,10,2011-04-12,1.65,17160.0,United Kingdom
577324,23509,MINI PLAYING CARDS FUN FAIR ,20,2011-11-18,0.42,16463.0,United Kingdom
549274,22516,CHILDS GARDEN RAKE BLUE,6,2011-04-07,2.1,12721.0,France
577549,22431,WATERING CAN BLUE ELEPHANT,3,2011-11-20,1.95,17841.0,United Kingdom
537646,21609,SET 12 LAVENDER  BOTANICAL T-LIGHTS,1,2010-12-07,2.95,17591.0,United Kingdom
572758,22138,BAKING SET 9 PIECE RETROSPOT ,1,2011-10-25,10.79,,United Kingdom
554514,35004B,SET OF 3 BLACK FLYING DUCKS,2,2011-05-24,5.79,,United Kingdom
540977,22911,PAPER CHAIN KIT LONDON,1,2011-01-12,5.91,,United Kingdom
579777,22355,CHARLOTTE BAG SUKI DESIGN,3,2011-11-30,1.63,,United Kingdom
550278,21989,PACK OF 20 SKULL PAPER NAPKINS,11,2011-04-15,1.63,,United Kingdom
560841,21642,ASSORTED TUTTI FRUTTI PEN,24,2011-07-21,0.29,14298.0,United Kingdom
539595,90185D,CRYSTAL DIAMANTE EXPANDABLE RING,1,2010-12-20,4.24,,United Kingdom
566287,22726,ALARM CLOCK BAKELIKE GREEN,4,2011-09-11,3.75,17218.0,United Kingdom
570688,22952,60 CAKE CASES VINTAGE CHRISTMAS,1,2011-10-11,1.25,,United Kingdom
577051,22118,JOY WOODEN BLOCK LETTERS,1,2011-11-17,4.95,14034.0,United Kingdom
544271,21245,GREEN POLKADOT PLATE ,8,2011-02-17,1.69,17083.0,United Kingdom
567899,21481,FAWN BLUE HOT WATER BOTTLE,8,2011-09-22,3.75,14911.0,EIRE
570200,20727,LUNCH BAG  BLACK SKULL.,4,2011-10-07,1.65,16918.0,United Kingdom
547360,22423,REGENCY CAKESTAND 3 TIER,16,2011-03-22,10.95,16135.0,United Kingdom
567671,47578A,ENGLISH ROSE SMALL SCENTED FLOWER,1,2011-09-21,1.63,,United Kingdom
568051,23188,VINTAGE  2 METER FOLDING RULER,12,2011-09-23,1.65,18189.0,United Kingdom
544937,37448,CERAMIC CAKE DESIGN SPOTTED MUG,12,2011-02-25,1.49,12839.0,United Kingdom
556459,22437,SET OF 9 BLACK SKULL BALLOONS,4,2011-06-10,1.63,,United Kingdom
566495,23264,SET OF 3 WOODEN SLEIGH DECORATIONS,3,2011-09-13,1.25,15529.0,United Kingdom
554512,85099B,JUMBO BAG RED RETROSPOT,5,2011-05-24,4.13,,United Kingdom
560398,22662,LUNCH BAG DOLLY GIRL DESIGN,30,2011-07-18,1.65,12731.0,France
544702,21626,VINTAGE UNION JACK PENNANT,12,2011-02-23,1.95,17135.0,United Kingdom
577078,85025B,EAU DE NILE HEART SHAPE PHOTO FRAME,1,2011-11-17,3.29,,United Kingdom
564758,84997C,CHILDRENS CUTLERY POLKADOT BLUE,1,2011-08-30,8.29,,United Kingdom
564200,22810,SET OF 6 T-LIGHTS SNOWMEN,1,2011-08-23,2.95,18018.0,United Kingdom
550458,84596L,BISCUITS SMALL BOWL LIGHT BLUE,1,2011-04-18,0.83,,United Kingdom
544479,22024,RAINY LADIES BIRTHDAY CARD,72,2011-02-21,0.36,14646.0,Netherlands
552269,21145,ANTIQUE GLASS PLACE SETTING,16,2011-05-08,1.25,16121.0,United Kingdom
560433,84661C,PINK SQUARE TABLE CLOCK,1,2011-07-18,4.96,,United Kingdom
566440,85123A,WHITE HANGING HEART T-LIGHT HOLDER,6,2011-09-12,2.95,15755.0,United Kingdom
555705,47591D,PINK FAIRY CAKE CHILDRENS APRON,2,2011-06-06,1.95,14713.0,United Kingdom
537240,22335,HEART DECORATION PAINTED ZINC ,9,2010-12-06,1.28,,United Kingdom
557007,22150,3 STRIPEY MICE FELTCRAFT,6,2011-06-16,1.95,12484.0,Spain
557500,82613C,"METAL SIGN,CUPCAKE SINGLE HOOK",1,2011-06-20,2.46,,United Kingdom
565472,23034,DRAWER KNOB CERAMIC BLACK,12,2011-09-05,1.45,16255.0,United Kingdom
557471,46776B,WOVEN BERRIES CUSHION COVER ,4,2011-06-20,4.95,15825.0,United Kingdom
580635,85123A,WHITE HANGING HEART T-LIGHT HOLDER,3,2011-12-05,2.95,14649.0,United Kingdom
580964,23202,JUMBO BAG VINTAGE LEAF,20,2011-12-06,2.08,15822.0,United Kingdom
572758,72799E,IVORY PILLAR CANDLE SILVER FLOCK,4,2011-10-25,3.29,,United Kingdom
562421,22115,METAL SIGN EMPIRE TEA,12,2011-08-04,0.79,15241.0,United Kingdom
572726,20751,FUNKY WASHING UP GLOVES ASSORTED,12,2011-10-25,2.1,16056.0,United Kingdom
537823,21811,CHRISTMAS HANGING HEART WITH BELL,1,2010-12-08,2.51,,United Kingdom
547396,21989,PACK OF 20 SKULL PAPER NAPKINS,2,2011-03-22,1.63,,United Kingdom
574076,22556,PLASTERS IN TIN CIRCUS PARADE ,1,2011-11-02,3.29,,United Kingdom
571267,22853,CAT BOWL VINTAGE CREAM,4,2011-10-16,3.25,17811.0,United Kingdom
549118,21042,RED RETROSPOT APRON ,3,2011-04-06,5.95,14911.0,EIRE
568346,85199S,SMALL HANGING IVORY/RED WOOD BIRD,1,2011-09-26,0.83,14096.0,United Kingdom
579516,23192,BUNDLE OF 3 ALPHABET EXERCISE BOOKS,1,2011-11-29,1.65,17841.0,United Kingdom
552418,22759,SET OF 3 NOTEBOOKS IN PARCEL,12,2011-05-09,1.65,13971.0,United Kingdom
554355,22425,ENAMEL COLANDER CREAM,3,2011-05-24,4.95,16992.0,United Kingdom
558159,47566,PARTY BUNTING,1,2011-06-27,4.95,16904.0,United Kingdom
540519,21936,RED RETROSPOT PICNIC BAG,10,2011-01-09,2.95,12793.0,Portugal
537781,22618,COOKING SET RETROSPOT,1,2010-12-08,9.95,17341.0,United Kingdom
561507,22328,ROUND SNACK BOXES SET OF 4 FRUITS ,6,2011-07-27,2.95,12397.0,Belgium
565201,22956,36 FOIL HEART CAKE CASES,12,2011-09-01,2.1,14907.0,United Kingdom
555635,23204,CHARLOTTE BAG APPLES DESIGN,10,2011-06-06,0.85,13319.0,United Kingdom
562955,20676,RED RETROSPOT BOWL,8,2011-08-11,2.46,,United Kingdom
571292,21866,UNION JACK FLAG LUGGAGE TAG,1,2011-10-16,1.25,15311.0,United Kingdom
549189,22302,COFFEE MUG PEARS  DESIGN,6,2011-04-07,2.55,15235.0,United Kingdom
568142,21159,MOODY BOY  DOOR HANGER ,1,2011-09-25,0.39,16744.0,United Kingdom
570187,22616,PACK OF 12 LONDON TISSUES ,10,2011-10-07,0.83,,United Kingdom
560892,22457,NATURAL SLATE HEART CHALKBOARD ,12,2011-07-21,2.95,13089.0,United Kingdom
569844,22546,MINI JIGSAW PURDEY,24,2011-10-06,0.42,12626.0,Germany
556017,21507,"ELEPHANT, BIRTHDAY CARD, ",12,2011-06-08,0.42,15382.0,United Kingdom
567340,21668,RED STRIPE CERAMIC DRAWER KNOB,12,2011-09-19,1.45,12540.0,Spain
545717,85099B,JUMBO BAG RED RETROSPOT,2,2011-03-07,4.13,,United Kingdom
559338,21866,UNION JACK FLAG LUGGAGE TAG,4,2011-07-07,0.83,,United Kingdom
560245,23293,SET OF 12 FAIRY CAKE BAKING CASES,2,2011-07-17,0.83,,Switzerland
546164,21974,SET OF 36 PAISLEY FLOWER DOILIES,12,2011-03-10,1.45,15939.0,United Kingdom
564168,20727,LUNCH BAG  BLACK SKULL.,2,2011-08-23,1.65,16794.0,United Kingdom
579399,21671,RED SPOT CERAMIC DRAWER KNOB,4,2011-11-29,1.45,13137.0,United Kingdom
577778,22789,T-LIGHT HOLDER SWEETHEART HANGING,1,2011-11-21,1.95,16549.0,United Kingdom
540458,20978,36 PENCILS TUBE SKULLS,16,2011-01-07,1.25,12501.0,Germany
558475,21936,RED RETROSPOT PICNIC BAG,2,2011-06-29,5.79,,United Kingdom
552232,21439,BASKET OF TOADSTOOLS,1,2011-05-06,2.46,,United Kingdom
558241,22469,HEART OF WICKER SMALL,40,2011-06-27,1.45,15932.0,United Kingdom
569472,22588,CARD HOLDER GINGHAM HEART,6,2011-10-04,2.89,14515.0,United Kingdom
537209,20615,BLUE POLKADOT PASSPORT COVER,1,2010-12-05,2.1,14606.0,United Kingdom
568400,85212,MINI PAINTED GARDEN DECORATION ,24,2011-09-27,0.29,13644.0,United Kingdom
544634,84997D,CHILDRENS CUTLERY POLKADOT PINK,2,2011-02-22,4.15,17994.0,United Kingdom
576665,35833P,4 PINK FLOCK CHRISTMAS BALLS,1,2011-11-16,1.25,17841.0,United Kingdom
576351,22734,SET OF 6 RIBBONS VINTAGE CHRISTMAS,24,2011-11-14,2.89,17235.0,United Kingdom
569010,21539,RED RETROSPOT BUTTER DISH,72,2011-09-30,4.25,14156.0,EIRE
548744,22501,PICNIC BASKET WICKER LARGE,2,2011-04-04,9.95,17725.0,United Kingdom
574096,23122,PARTY CHARMS 50 PIECES,12,2011-11-03,0.83,13599.0,United Kingdom
552232,84971S,SMALL HEART FLOWERS HOOK ,3,2011-05-06,1.63,,United Kingdom
542272,22858,EASTER TIN KEEPSAKE,6,2011-01-27,1.65,16496.0,United Kingdom
566864,47574A,ENGLISH ROSE SCENTED HANGING FLOWER,2,2011-09-15,0.75,17786.0,United Kingdom
578531,84012,MAGIC SHEEP WOOL GROWING FROM PAPER,5,2011-11-24,0.85,17364.0,United Kingdom
575477,90134,OLD ROSE COMBO BEAD NECKLACE,1,2011-11-09,2.9,,United Kingdom
555348,15056BL,EDWARDIAN PARASOL BLACK,2,2011-06-02,5.95,15184.0,United Kingdom
560937,22545,MINI JIGSAW BUNNIES,1,2011-07-22,0.42,17920.0,United Kingdom
560186,84527,FLAMES SUNGLASSES PINK LENSES,1,2011-07-15,1.95,17266.0,United Kingdom
570690,22578,WOODEN STAR CHRISTMAS SCANDINAVIAN,7,2011-10-11,0.83,,United Kingdom
560780,22077,6 RIBBONS RUSTIC CHARM,1,2011-07-21,4.13,,United Kingdom
542898,22425,ENAMEL COLANDER CREAM,1,2011-02-01,4.95,16110.0,United Kingdom
536591,21488,RED WHITE SCARF  HOT WATER BOTTLE,1,2010-12-01,3.95,14606.0,United Kingdom
568057,22156,HEART DECORATION WITH PEARLS ,1,2011-09-23,1.63,,United Kingdom
571509,23323,WHITE WICKER STAR ,6,2011-10-17,2.1,13110.0,United Kingdom
537418,22941,CHRISTMAS LIGHTS 10 REINDEER,1,2010-12-06,8.5,17884.0,United Kingdom
543459,21086,SET/6 RED SPOTTY PAPER CUPS,24,2011-02-08,0.65,12599.0,France
575930,21166,COOK WITH WINE METAL SIGN ,2,2011-11-11,4.13,,United Kingdom
580978,22730,ALARM CLOCK BAKELIKE IVORY,8,2011-12-06,3.75,13078.0,United Kingdom
549999,22626,BLACK KITCHEN SCALES,2,2011-04-14,8.5,15813.0,United Kingdom
576329,22693,GROW A FLYTRAP OR SUNFLOWER IN TIN,2,2011-11-14,2.5,,United Kingdom
538533,22417,PACK OF 60 SPACEBOY CAKE CASES,2,2010-12-13,0.55,14796.0,United Kingdom
577531,23368,SET 12 COLOUR PENCILS DOLLY GIRL ,13,2011-11-20,1.25,,United Kingdom
554998,22423,REGENCY CAKESTAND 3 TIER,3,2011-05-29,12.75,15925.0,United Kingdom
536569,22767,TRIPLE PHOTO FRAME CORNICE ,1,2010-12-01,9.95,16274.0,United Kingdom
544102,22822,CREAM WALL PLANTER HEART SHAPED,4,2011-02-16,5.95,14665.0,United Kingdom
570672,21125,SET 6 FOOTBALL CELEBRATION CANDLES,12,2011-10-11,1.25,12536.0,France
581334,22308,TEA COSY BLUE STRIPE,1,2011-12-08,2.55,17841.0,United Kingdom
573892,21080,SET/20 RED RETROSPOT PAPER NAPKINS ,12,2011-11-01,0.85,14911.0,EIRE
547555,22466,FAIRY TALE COTTAGE NIGHTLIGHT,12,2011-03-23,1.95,14075.0,United Kingdom
571909,21865,PINK UNION JACK  PASSPORT COVER ,1,2011-10-19,2.1,15006.0,United Kingdom
559338,21944,KITTENS DESIGN FLANNEL,3,2011-07-07,0.83,,United Kingdom
551339,21790,VINTAGE SNAP CARDS,3,2011-04-27,1.63,,United Kingdom
557962,22998,TRAVEL CARD WALLET KEEP CALM,24,2011-06-24,0.42,13709.0,United Kingdom
562370,22969,HOMEMADE JAM SCENTED CANDLES,12,2011-08-04,1.45,12626.0,Germany
566017,22139,RETROSPOT TEA SET CERAMIC 11 PC ,6,2011-09-08,4.95,13330.0,United Kingdom
575875,23382,BOX OF 6 CHRISTMAS CAKE DECORATIONS,2,2011-11-11,7.46,,United Kingdom
544476,22995,TRAVEL CARD WALLET SUKI,6,2011-02-21,0.42,14796.0,United Kingdom
556484,22084,PAPER CHAIN KIT EMPIRE,2,2011-06-12,2.95,16938.0,United Kingdom
570388,22960,JAM MAKING SET WITH JARS,6,2011-10-10,4.25,14911.0,EIRE
578120,84946,ANTIQUE SILVER T-LIGHT GLASS,12,2011-11-23,1.25,14493.0,United Kingdom
567671,22714,CARD BIRTHDAY COWBOY,2,2011-09-21,0.83,,United Kingdom
545897,85099F,JUMBO BAG STRAWBERRY,1,2011-03-07,4.13,,United Kingdom
542233,22847,BREAD BIN DINER STYLE IVORY,4,2011-01-26,14.95,13098.0,United Kingdom
537376,16156S,WRAP PINK FAIRY CAKES ,25,2010-12-06,0.42,16722.0,United Kingdom
545078,16238,PARTY TIME PENCIL ERASERS,1,2011-02-28,0.42,,United Kingdom
563358,21754,HOME BUILDING BLOCK WORD,2,2011-08-15,5.95,17858.0,United Kingdom
577077,22633,HAND WARMER UNION JACK,7,2011-11-17,2.1,17799.0,United Kingdom
C564759,21471,STRAWBERRY RAFFIA FOOD COVER,-2,2011-08-30,3.75,14911.0,EIRE
548511,22441,GROW YOUR OWN BASIL IN ENAMEL MUG,5,2011-03-31,2.1,14056.0,United Kingdom
569653,84792,ENCHANTED BIRD COATHANGER 5 HOOK,12,2011-10-05,4.65,12451.0,Switzerland
547907,84796B,BLUE SAVANNAH PICNIC HAMPER FOR 2,1,2011-03-28,12.75,15083.0,United Kingdom
574034,22308,TEA COSY BLUE STRIPE,1,2011-11-02,2.55,17841.0,United Kingdom
556218,23108,SET OF 10 LED DOLLY LIGHTS,2,2011-06-09,6.25,17731.0,United Kingdom
563689,22189,CREAM HEART CARD HOLDER,2,2011-08-18,3.95,15743.0,United Kingdom
542881,22296,HEART IVORY TRELLIS LARGE,4,2011-02-01,1.65,14587.0,United Kingdom
575930,23245,SET OF 3 REGENCY CAKE TINS,2,2011-11-11,10.79,,United Kingdom
552520,21790,VINTAGE SNAP CARDS,7,2011-05-09,1.63,,United Kingdom
572567,22705,WRAP GREEN PEARS ,25,2011-10-25,0.42,12398.0,Switzerland
558085,85099B,JUMBO BAG RED RETROSPOT,30,2011-06-26,2.08,13021.0,United Kingdom
549964,22191,IVORY DINER WALL CLOCK,2,2011-04-13,8.5,13122.0,United Kingdom
581219,22074,6 RIBBONS SHIMMERING PINKS ,2,2011-12-08,1.25,,United Kingdom
547498,84228,HEN HOUSE W CHICK STANDING,8,2011-03-23,0.42,15021.0,United Kingdom
580259,21136,PAINTED METAL PEARS ASSORTED,16,2011-12-02,1.69,13705.0,United Kingdom
578017,21137,BLACK RECORD COVER FRAME,2,2011-11-22,3.75,13569.0,United Kingdom
566310,22456,NATURAL SLATE CHALKBOARD LARGE ,18,2011-09-12,4.25,15980.0,United Kingdom
561712,84970L,SINGLE HEART ZINC T-LIGHT HOLDER,12,2011-07-29,0.95,14499.0,United Kingdom
566281,21174,POTTERING IN THE SHED METAL SIGN,12,2011-09-11,2.08,12748.0,United Kingdom
552852,23206,LUNCH BAG APPLE DESIGN,3,2011-05-11,1.65,16712.0,United Kingdom
569460,22795,SWEETHEART RECIPE BOOK STAND,2,2011-10-04,6.75,13895.0,United Kingdom
544177,21136,PAINTED METAL PEARS ASSORTED,8,2011-02-16,1.69,13001.0,United Kingdom
555739,22326,ROUND SNACK BOXES SET OF4 WOODLAND ,6,2011-06-07,2.95,12380.0,Belgium
571669,23006,TRAVEL CARD WALLET FLOWER MEADOW,15,2011-10-18,0.42,17758.0,United Kingdom
538177,84947,ANTIQUE SILVER TEA GLASS ENGRAVED,4,2010-12-10,2.51,,United Kingdom
573582,71477,COLOUR GLASS. STAR T-LIGHT HOLDER,12,2011-10-31,3.95,16633.0,United Kingdom
547651,22444,GROW YOUR OWN PLANT IN A CAN ,48,2011-03-24,1.25,16904.0,United Kingdom
547788,20725,LUNCH BAG RED RETROSPOT,1,2011-03-25,4.13,,United Kingdom
545996,22617,BAKING SET SPACEBOY DESIGN,2,2011-03-08,4.95,14367.0,United Kingdom
579444,23250,VINTAGE RED TRIM ENAMEL BOWL ,12,2011-11-29,1.25,13999.0,United Kingdom
570022,22083,PAPER CHAIN KIT RETROSPOT,6,2011-10-07,2.95,14067.0,United Kingdom
562444,22355,CHARLOTTE BAG SUKI DESIGN,3,2011-08-04,0.85,14713.0,United Kingdom
549577,22907,PACK OF 20 NAPKINS PANTRY DESIGN,12,2011-04-11,0.85,14286.0,United Kingdom
573576,22908,PACK OF 20 NAPKINS RED APPLES,1,2011-10-31,1.63,14096.0,United Kingdom
564162,23268,SET OF 2 CERAMIC CHRISTMAS REINDEER,12,2011-08-23,1.45,13481.0,United Kingdom
537034,22780,LIGHT GARLAND BUTTERFILES PINK,8,2010-12-03,4.25,13081.0,United Kingdom
575707,22660,DOORMAT I LOVE LONDON,2,2011-11-10,8.25,12538.0,Spain
553711,21122,SET/10 PINK POLKADOT PARTY CANDLES,24,2011-05-18,1.25,13552.0,United Kingdom
568134,23013,GLASS APOTHECARY BOTTLE TONIC,1,2011-09-23,8.29,,United Kingdom
569246,23268,SET OF 2 CERAMIC CHRISTMAS REINDEER,5,2011-10-03,2.92,14096.0,United Kingdom
536425,79321,CHILLI LIGHTS,8,2010-12-01,4.95,13758.0,United Kingdom
541696,21220,SET/4 BADGES DOGS,4,2011-01-20,0.83,,United Kingdom
549241,21155,RED RETROSPOT PEG BAG,2,2011-04-07,2.55,15719.0,United Kingdom
C539066,47590A,BLUE HAPPY BIRTHDAY BUNTING,-1,2010-12-15,5.45,17912.0,United Kingdom
551004,22653,BUTTON BOX ,1,2011-04-26,4.13,,United Kingdom
561209,37446,MINI CAKE STAND WITH HANGING CAKES,1,2011-07-25,3.29,,United Kingdom
C571902,22812,PACK 3 BOXES CHRISTMAS PANNETONE,-3,2011-10-19,1.95,14488.0,United Kingdom
565915,22867,HAND WARMER BIRD DESIGN,5,2011-09-07,2.1,15752.0,United Kingdom
C569320,23112,PARISIENNE CURIO CABINET,-2,2011-10-03,7.5,15301.0,United Kingdom
560979,21983,PACK OF 12 BLUE PAISLEY TISSUES ,24,2011-07-22,0.29,15232.0,United Kingdom
571203,23490,T-LIGHT HOLDER HANGING LOVE BIRD,6,2011-10-14,3.75,17677.0,United Kingdom
568721,21812,GARLAND WITH HEARTS AND BELLS,1,2011-09-28,3.29,,United Kingdom
562143,21380,WOODEN HAPPY BIRTHDAY GARLAND,12,2011-08-03,2.95,16422.0,United Kingdom
565541,84997B,CHILDRENS CUTLERY RETROSPOT RED ,3,2011-09-05,4.15,14159.0,United Kingdom
568100,22662,LUNCH BAG DOLLY GIRL DESIGN,10,2011-09-23,1.65,15475.0,United Kingdom
536635,21754,HOME BUILDING BLOCK WORD,6,2010-12-02,5.95,15955.0,United Kingdom
578366,82483,WOOD 2 DRAWER CABINET WHITE FINISH,2,2011-11-24,6.95,16173.0,United Kingdom
540176,22767,TRIPLE PHOTO FRAME CORNICE ,16,2011-01-05,8.5,17511.0,United Kingdom
538499,20748,KENSINGTON COFFEE SET,3,2010-12-12,12.75,17819.0,United Kingdom
578833,22141,CHRISTMAS CRAFT TREE TOP ANGEL,8,2011-11-25,4.13,,United Kingdom
576339,22070,SMALL RED RETROSPOT MUG IN BOX ,1,2011-11-14,7.46,14096.0,United Kingdom
559816,84907,PINK YELLOW PATCH CUSHION COVER,2,2011-07-12,5.79,,United Kingdom
537612,21733,RED HANGING HEART T-LIGHT HOLDER,6,2010-12-07,2.95,13769.0,United Kingdom
547698,22423,REGENCY CAKESTAND 3 TIER,4,2011-03-24,12.75,15304.0,United Kingdom
