InvoiceNo,StockCode,Description,Quantity,InvoiceDate,UnitPrice,CustomerID,Country
566985,22361,GLASS JAR DAISY FRESH COTTON WOOL,1,2011-09-16,5.79,,United Kingdom
552465,23209,LUNCH BAG DOILEY PATTERN ,10,2011-05-09,1.65,16242.0,United Kingdom
577723,20727,LUNCH BAG  BLACK SKULL.,2,2011-11-21,1.65,16713.0,United Kingdom
548312,22804,CANDLEHOLDER PINK HANGING HEART,4,2011-03-30,2.95,16059.0,United Kingdom
576329,20840,FRENCH FLORAL CUSHION COVER ,3,2011-11-14,3.29,,United Kingdom
553886,23201,JUMBO BAG ALPHABET,10,2011-05-19,1.95,15648.0,United Kingdom
568715,22989,SET 2 PANTRY DESIGN TEA TOWELS,1,2011-09-28,3.25,17783.0,United Kingdom
548167,21928,JUMBO BAG SCANDINAVIAN BLUE PAISLEY,1,2011-03-29,4.13,,United Kingdom
537915,22561,WOODEN SCHOOL COLOURING SET,12,2010-12-09,1.65,12797.0,Portugal
546422,22457,NATURAL SLATE HEART CHALKBOARD ,4,2011-03-13,2.95,15547.0,United Kingdom
575136,23274,STAR T-LIGHT HOLDER WILLIE WINKIE,12,2011-11-08,1.65,15103.0,United Kingdom
566484,85049E,SCANDINAVIAN REDS RIBBONS,12,2011-09-13,1.25,13880.0,United Kingdom
546275,22281,EASTER TREE YELLOW BIRDS,2,2011-03-10,5.95,13126.0,United Kingdom
566249,22144,CHRISTMAS CRAFT LITTLE FRIENDS,1,2011-09-11,2.1,13527.0,United Kingdom
C541654,21843,RED RETROSPOT CAKE STAND,-6,2011-01-20,10.95,12540.0,Spain
578519,22327,ROUND SNACK BOXES SET OF 4 SKULLS,1,2011-11-24,2.95,14591.0,United Kingdom
577078,21098,CHRISTMAS TOILET ROLL,6,2011-11-17,2.46,,United Kingdom
575875,22024,RAINY LADIES BIRTHDAY CARD,1,2011-11-11,0.83,,United Kingdom
543182,22383,LUNCH BAG SUKI  DESIGN ,1,2011-02-04,4.13,,United Kingdom
555931,22244,3 HOOK HANGER MAGIC GARDEN,12,2011-06-08,1.95,17828.0,Malta
577557,21982,PACK OF 12 SUKI TISSUES ,1,2011-11-20,0.39,15426.0,United Kingdom
541971,22325,MOBILE VINTAGE HEARTS ,1,2011-01-24,11.63,,United Kingdom
568909,82494L,WOODEN FRAME ANTIQUE WHITE ,6,2011-09-29,2.95,16818.0,United Kingdom
545530,23176,ABC TREASURE BOOK BOX ,8,2011-03-03,2.25,17416.0,United Kingdom
561007,22411,JUMBO SHOPPER VINTAGE RED PAISLEY,10,2011-07-22,2.08,15640.0,United Kingdom
539041,22422,TOOTHPASTE TUBE PEN,6,2010-12-15,0.65,15456.0,United Kingdom
559693,85176,SEWING SUSAN 21 NEEDLE SET,3,2011-07-11,0.79,,United Kingdom
544105,21669,BLUE STRIPE CERAMIC DRAWER KNOB,24,2011-02-16,1.25,17567.0,United Kingdom
C556635,22697,GREEN REGENCY TEACUP AND SAUCER,-1,2011-06-13,2.95,13505.0,Switzerland
551529,23206,LUNCH BAG APPLE DESIGN,40,2011-05-01,1.65,12524.0,Germany
569521,22432,WATERING CAN PINK BUNNY,1,2011-10-04,1.95,16474.0,United Kingdom
571180,22485,SET OF 2 WOODEN MARKET CRATES,6,2011-10-14,12.75,15498.0,United Kingdom
555562,21975,PACK OF 60 DINOSAUR CAKE CASES,5,2011-06-05,0.55,17841.0,United Kingdom
564230,22382,LUNCH BAG SPACEBOY DESIGN ,11,2011-08-24,4.96,,United Kingdom
576345,22644,CERAMIC CHERRY CAKE MONEY BANK,12,2011-11-14,1.45,12374.0,Austria
540646,21032,SPACE CADET WHITE,2,2011-01-10,0.85,,United Kingdom
543989,22666,RECIPE BOX PANTRY YELLOW DESIGN,96,2011-02-15,2.55,12415.0,Australia
571914,22523,CHILDS GARDEN FORK PINK,12,2011-10-19,0.85,14776.0,United Kingdom
552234,84923,PINK BUTTERFLY HANDBAG W BOBBLES,1,2011-05-06,4.13,,United Kingdom
568517,22277,COSMETIC BAG VINTAGE ROSE PAISLEY,1,2011-09-27,2.1,14456.0,United Kingdom
553141,22277,COSMETIC BAG VINTAGE ROSE PAISLEY,1,2011-05-13,2.1,15907.0,United Kingdom
556459,22182,CAKE STAND VICTORIAN FILIGREE SMALL,1,2011-06-10,4.13,,United Kingdom
574918,47591D,PINK FAIRY CAKE CHILDRENS APRON,1,2011-11-07,1.95,,France
544911,22832,BROCANTE SHELF WITH HOOKS,2,2011-02-24,10.75,16838.0,United Kingdom
569897,22866,HAND WARMER SCOTTY DOG DESIGN,1,2011-10-06,2.1,17813.0,United Kingdom
578065,21935,SUKI  SHOULDER BAG,5,2011-11-22,1.63,,United Kingdom
564958,23256,CHILDRENS CUTLERY SPACEBOY ,8,2011-08-31,4.15,13089.0,United Kingdom
541695,85174,S/4 CACTI CANDLES,1,2011-01-20,4.13,,United Kingdom
572550,22768,FAMILY PHOTO FRAME CORNICE,1,2011-10-24,19.96,,United Kingdom
574051,90160C,TURQ+RED BOUDICCA LARGE BRACELET,1,2011-11-02,6.95,14102.0,United Kingdom
559052,20977,36 PENCILS TUBE WOODLAND,1,2011-07-05,2.46,,United Kingdom
567656,22116,METAL SIGN HIS DINNER IS SERVED,3,2011-09-21,1.63,14096.0,United Kingdom
572283,22569,FELTCRAFT CUSHION BUTTERFLY,2,2011-10-23,3.75,15000.0,United Kingdom
540185,16161P,WRAP ENGLISH ROSE ,25,2011-01-05,0.42,14653.0,United Kingdom
541421,22214,CANDLE PLATE LACE WHITE,4,2011-01-17,1.63,,United Kingdom
573340,23309,SET OF 60 I LOVE LONDON CAKE CASES ,2,2011-10-30,0.55,14159.0,United Kingdom
565150,23183,MOTHER'S KITCHEN SPOON REST ,6,2011-09-01,3.29,14298.0,United Kingdom
556080,21242,RED RETROSPOT PLATE ,3,2011-06-08,3.29,,United Kingdom
576617,84032B,CHARLIE + LOLA RED HOT WATER BOTTLE,3,2011-11-15,3.29,,United Kingdom
557277,22138,BAKING SET 9 PIECE RETROSPOT ,3,2011-06-19,4.95,16484.0,United Kingdom
564221,22469,HEART OF WICKER SMALL,5,2011-08-24,4.13,,United Kingdom
539324,22563,HAPPY STENCIL CRAFT,1,2010-12-16,1.25,14985.0,United Kingdom
542624,20711,JUMBO BAG TOYS ,2,2011-01-31,4.13,,United Kingdom
551876,84832,ZINC WILLIE WINKIE  CANDLE STICK,12,2011-05-05,0.85,14867.0,United Kingdom
548554,85132C,CHARLIE AND LOLA FIGURES TINS,12,2011-04-01,1.95,13694.0,United Kingdom
552231,22693,GROW A FLYTRAP OR SUNFLOWER IN TIN,24,2011-05-06,1.25,17364.0,United Kingdom
556926,22557,PLASTERS IN TIN VINTAGE PAISLEY ,1,2011-06-15,1.65,16324.0,United Kingdom
564818,22378,WALL TIDY RETROSPOT ,1,2011-08-30,4.13,,United Kingdom
575037,22578,WOODEN STAR CHRISTMAS SCANDINAVIAN,20,2011-11-08,0.29,16066.0,United Kingdom
577690,21744,SNOWFLAKE PORTABLE TABLE LIGHT ,1,2011-11-21,2.95,12856.0,United Kingdom
566733,22826,LOVE SEAT ANTIQUE WHITE METAL,1,2011-09-14,85.0,15103.0,United Kingdom
548196,22766,PHOTO FRAME CORNICE,4,2011-03-29,2.95,16011.0,United Kingdom
561511,22287,DECORATION WOBBLY CHICKEN,24,2011-07-27,0.39,15624.0,United Kingdom
541133,15056n,EDWARDIAN PARASOL NATURAL,1,2011-01-14,12.46,,United Kingdom
547066,21244,BLUE POLKADOT PLATE ,8,2011-03-20,1.69,12921.0,United Kingdom
572284,22382,LUNCH BAG SPACEBOY DESIGN ,6,2011-10-23,1.65,16744.0,United Kingdom
563917,21080,SET/20 RED RETROSPOT PAPER NAPKINS ,3,2011-08-21,0.85,14572.0,United Kingdom
545340,22619,SET OF 6 SOLDIER SKITTLES,4,2011-03-02,3.75,15416.0,United Kingdom
573548,22114,HOT WATER BOTTLE TEA AND SYMPATHY,4,2011-10-31,4.25,13680.0,United Kingdom
574474,21744,SNOWFLAKE PORTABLE TABLE LIGHT ,1,2011-11-04,2.95,17979.0,United Kingdom
538851,21035,SET/2 RED RETROSPOT TEA TOWELS ,6,2010-12-14,2.95,16556.0,United Kingdom
562460,23146,TRIPLE HOOK ANTIQUE IVORY ROSE,1,2011-08-05,3.29,17841.0,United Kingdom
551005,23177,TREASURE ISLAND BOOK BOX,1,2011-04-26,4.58,,United Kingdom
539735,21916,SET 12 RETRO WHITE CHALK STICKS,1,2010-12-21,0.81,,United Kingdom
569230,22361,GLASS JAR DAISY FRESH COTTON WOOL,1,2011-10-02,2.95,16533.0,United Kingdom
540992,22693,GROW A FLYTRAP OR SUNFLOWER IN TIN,24,2011-01-12,1.25,17364.0,United Kingdom
579672,20749,ASSORTED COLOUR MINI CASES,12,2011-11-30,6.35,14005.0,United Kingdom
563037,22352,LUNCH BOX WITH CUTLERY RETROSPOT ,6,2011-08-11,2.55,12362.0,Belgium
575508,22962,JAM JAR WITH PINK LID,48,2011-11-10,0.72,14646.0,Netherlands
566290,21984,PACK OF 12 PINK PAISLEY TISSUES ,1,2011-09-11,0.39,14456.0,United Kingdom
581405,84991,60 TEATIME FAIRY CAKE CASES,1,2011-12-08,0.55,13521.0,United Kingdom
578420,48194,DOORMAT HEARTS,2,2011-11-24,8.25,16326.0,United Kingdom
537216,22357,KINGS CHOICE BISCUIT TIN,4,2010-12-05,4.25,15502.0,United Kingdom
571741,85099B,JUMBO BAG RED RETROSPOT,10,2011-10-19,2.08,15610.0,United Kingdom
C554847,23298,SPOTTY BUNTING,-3,2011-05-26,4.95,12909.0,United Kingdom
550280,22677,FRENCH BLUE METAL DOOR SIGN 2,1,2011-04-15,1.25,13048.0,United Kingdom
540275,20728,LUNCH BAG CARS BLUE,30,2011-01-06,1.65,13680.0,United Kingdom
548894,22720,SET OF 3 CAKE TINS PANTRY DESIGN ,2,2011-04-04,10.79,,United Kingdom
574722,23453,OVAL  MINI PORTRAIT FRAME,2,2011-11-06,1.95,14502.0,United Kingdom
575739,35953,FOLKART STAR CHRISTMAS DECORATIONS,4,2011-11-11,0.61,,United Kingdom
567211,21232,STRAWBERRY CERAMIC TRINKET BOX,4,2011-09-19,1.25,14159.0,United Kingdom
541516,21881,CUTE CATS TAPE,3,2011-01-18,0.42,,United Kingdom
564302,35970,ZINC FOLKART SLEIGH BELLS,12,2011-08-24,1.69,15932.0,United Kingdom
546389,48194,DOORMAT HEARTS,2,2011-03-11,7.95,16801.0,United Kingdom
569720,23365,SET 12 COLOUR PENCILS LOVE LONDON,1,2011-10-06,0.65,14646.0,Netherlands
562427,21922,UNION STRIPE WITH FRINGE  HAMMOCK,1,2011-08-04,7.95,17267.0,United Kingdom
553890,22166,WALL MIRROR RECTANGLE DIAMANTE PINK,1,2011-05-19,7.46,,United Kingdom
575216,23493,VINTAGE DOILY TRAVEL SEWING KIT,10,2011-11-09,1.95,13384.0,United Kingdom
557319,22558,CLOTHES PEGS RETROSPOT PACK 24 ,12,2011-06-20,1.65,15076.0,United Kingdom
572549,15056N,EDWARDIAN PARASOL NATURAL,1,2011-10-24,12.46,,United Kingdom
551138,22719,GUMBALL MONOCHROME COAT RACK,36,2011-04-26,1.06,17061.0,United Kingdom
540992,21326,AGED GLASS SILVER T-LIGHT HOLDER,12,2011-01-12,0.65,17364.0,United Kingdom
552514,84913A,SOFT PINK ROSE TOWEL ,2,2011-05-09,3.29,,United Kingdom
538509,22437,SET OF 9 BLACK SKULL BALLOONS,12,2010-12-12,0.85,14413.0,United Kingdom
565386,22174,PHOTO CUBE,6,2011-09-02,1.65,17997.0,United Kingdom
550255,37447,CERAMIC CAKE DESIGN SPOTTED PLATE,12,2011-04-15,1.49,13468.0,United Kingdom
559039,21989,PACK OF 20 SKULL PAPER NAPKINS,1,2011-07-05,1.63,,United Kingdom
581266,17003,BROCADE RING PURSE ,72,2011-12-08,0.39,12621.0,Germany
537666,22335,HEART DECORATION PAINTED ZINC ,2,2010-12-07,1.28,,United Kingdom
543836,22965,3 TRADITIONAl BISCUIT CUTTERS  SET,6,2011-02-14,2.1,15236.0,United Kingdom
537851,22646,CERAMIC STRAWBERRY CAKE MONEY BANK,72,2010-12-08,1.25,13758.0,United Kingdom
558196,22120,WELCOME  WOODEN BLOCK LETTERS,1,2011-06-27,9.95,16033.0,United Kingdom
539262,37342,POLKADOT COFFEE CUP & SAUCER PINK,24,2010-12-16,0.85,15789.0,United Kingdom
546406,22366,DOORMAT AIRMAIL ,1,2011-03-11,15.79,,United Kingdom
553547,22431,WATERING CAN BLUE ELEPHANT,12,2011-05-17,1.95,12474.0,Germany
575073,22750,FELTCRAFT PRINCESS LOLA DOLL,3,2011-11-08,3.75,13975.0,United Kingdom
576339,23308,SET OF 60 VINTAGE LEAF CAKE CASES ,5,2011-11-14,1.25,14096.0,United Kingdom
555896,22629,SPACEBOY LUNCH BOX ,6,2011-06-07,1.95,15640.0,United Kingdom
569372,22725,ALARM CLOCK BAKELIKE CHOCOLATE,1,2011-10-03,7.46,,United Kingdom
571246,21163,DO NOT TOUCH MY STUFF DOOR HANGER ,10,2011-10-14,0.39,17750.0,United Kingdom
566872,22383,LUNCH BAG SUKI DESIGN ,10,2011-09-15,1.65,16729.0,United Kingdom
575989,22082,RIBBON REEL STRIPES DESIGN ,2,2011-11-13,1.65,14698.0,United Kingdom
C579935,71477,COLOURED GLASS STAR T-LIGHT HOLDER,-6,2011-12-01,3.95,14188.0,United Kingdom
565236,23250,VINTAGE RED TRIM ENAMEL BOWL ,12,2011-09-02,1.25,14276.0,United Kingdom
558933,22992,REVOLVER WOODEN RULER ,24,2011-07-05,1.95,16098.0,United Kingdom
560773,84596B,SMALL DOLLY MIX DESIGN ORANGE BOWL,3,2011-07-20,0.83,,United Kingdom
563184,84522,PINK PARTY SUNGLASSES,1,2011-08-12,1.95,17516.0,United Kingdom
545045,22241,GARLAND WOODEN HAPPY EASTER,3,2011-02-27,1.25,15708.0,United Kingdom
551991,90175C,BLUE GLASS CHUNKY CHARM BRACELET,1,2011-05-05,8.95,14697.0,United Kingdom
547658,22665,RECIPE BOX BLUE SKETCHBOOK DESIGN,1,2011-03-24,2.95,13736.0,United Kingdom
575930,23225,CHERUB HEART DECORATION SILVER ,5,2011-11-11,1.63,,United Kingdom
568312,21210,SET OF 72 RETROSPOT PAPER  DOILIES,12,2011-09-26,1.45,18241.0,United Kingdom
577768,23551,PACK OF 12 PAISLEY PARK TISSUES ,2,2011-11-21,0.83,,United Kingdom
539437,21819,GLITTER CHRISTMAS STAR ,3,2010-12-17,1.66,,United Kingdom
560555,85123A,WHITE HANGING HEART T-LIGHT HOLDER,1,2011-07-19,2.95,14178.0,United Kingdom
536830,21915,RED  HARMONICA IN BOX ,1400,2010-12-02,1.06,16754.0,United Kingdom
546007,47559B,TEA TIME OVEN GLOVE,2,2011-03-08,2.46,,United Kingdom
541564,20685,DOORMAT RED RETROSPOT,1,2011-01-19,7.95,16904.0,United Kingdom
576834,23354,6 GIFT TAGS 50'S CHRISTMAS ,12,2011-11-16,0.83,13458.0,United Kingdom
566075,47578A,ENGLISH ROSE SMALL SCENTED FLOWER,10,2011-09-09,0.85,16173.0,United Kingdom
544316,22427,ENAMEL FLOWER JUG CREAM,3,2011-02-17,5.95,16556.0,United Kingdom
568135,84997B,CHILDRENS CUTLERY RETROSPOT RED ,3,2011-09-23,8.29,,United Kingdom
553549,22678,FRENCH BLUE METAL DOOR SIGN 3,2,2011-05-17,2.46,,United Kingdom
537861,22111,SCOTTIE DOG HOT WATER BOTTLE,3,2010-12-08,4.95,16596.0,United Kingdom
547967,21937,STRAWBERRY   PICNIC BAG,1,2011-03-28,5.79,,United Kingdom
C556869,23146,TRIPLE HOOK ANTIQUE IVORY ROSE,-4,2011-06-15,3.29,13199.0,United Kingdom
545475,22714,CARD BIRTHDAY COWBOY,144,2011-03-03,0.36,12415.0,Australia
544204,85099B,JUMBO BAG RED RETROSPOT,1,2011-02-17,4.13,,United Kingdom
552658,84563A,PINK & WHITE BREAKFAST TRAY,1,2011-05-10,2.95,14534.0,United Kingdom
554065,22644,CERAMIC CHERRY CAKE MONEY BANK,12,2011-05-22,1.45,18287.0,United Kingdom
574670,22219,LOVEBIRD HANGING DECORATION WHITE ,4,2011-11-06,0.85,12838.0,United Kingdom
571697,23346,SPACEBOY BEAKER,12,2011-10-18,1.25,12759.0,Netherlands
548514,82482,WOODEN PICTURE FRAME WHITE FINISH,1,2011-03-31,4.96,,United Kingdom
581492,22277,COSMETIC BAG VINTAGE ROSE PAISLEY,1,2011-12-09,4.13,,United Kingdom
546950,22500,SET OF 2 TINS JARDIN DE PROVENCE,1,2011-03-18,4.95,16511.0,United Kingdom
571433,23174,REGENCY SUGAR BOWL GREEN,4,2011-10-17,4.15,13015.0,United Kingdom
536805,20974,12 PENCILS SMALL TUBE SKULL,24,2010-12-02,0.65,14775.0,United Kingdom
564855,22161,HEART DECORATION RUSTIC HANGING ,24,2011-08-31,0.19,16746.0,United Kingdom
558861,22423,REGENCY CAKESTAND 3 TIER,2,2011-07-04,12.75,13373.0,United Kingdom
573359,23377,PACK OF 12 DOLLY GIRL TISSUES,4,2011-10-30,0.39,14178.0,United Kingdom
540646,84916,HAND TOWEL PALE BLUE W FLOWERS,1,2011-01-10,4.21,,United Kingdom
541792,22521,CHILDS GARDEN TROWEL PINK,12,2011-01-21,0.85,17094.0,United Kingdom
566194,22170,PICTURE FRAME WOOD TRIPLE PORTRAIT,1,2011-09-09,6.75,14711.0,United Kingdom
540467,22666,RECIPE BOX PANTRY YELLOW DESIGN,6,2011-01-07,2.95,18198.0,United Kingdom
574624,23358,HOT STUFF HOT WATER BOTTLE,3,2011-11-06,3.75,17769.0,United Kingdom
564656,10135,COLOURING PENCILS BROWN TUBE,10,2011-08-26,1.25,14141.0,United Kingdom
575698,22573,STAR WOODEN CHRISTMAS DECORATION,12,2011-11-10,0.85,16094.0,United Kingdom
565243,23201,JUMBO BAG ALPHABET,10,2011-09-02,2.08,16735.0,United Kingdom
546115,47591D,PINK FAIRY CAKE CHILDRENS APRON,8,2011-03-09,1.95,15379.0,United Kingdom
536551,22557,PLASTERS IN TIN VINTAGE PAISLEY ,1,2010-12-01,1.65,17346.0,United Kingdom
550957,20728,LUNCH BAG CARS BLUE,2,2011-04-21,1.65,18283.0,United Kingdom
577473,21993,FLORAL FOLK STATIONERY SET,1,2011-11-20,1.25,15919.0,United Kingdom
540023,84997D,PINK 3 PIECE POLKADOT CUTLERY SET,2,2011-01-04,3.75,15039.0,United Kingdom
557500,20719,WOODLAND CHARLOTTE BAG,2,2011-06-20,1.63,,United Kingdom
572650,20727,LUNCH BAG  BLACK SKULL.,2,2011-10-25,1.65,15506.0,United Kingdom
579508,22961,JAM MAKING SET PRINTED,9,2011-11-29,3.29,,United Kingdom
546031,84978,HANGING HEART JAR T-LIGHT HOLDER,12,2011-03-09,1.25,13267.0,United Kingdom
545333,21871,SAVE THE PLANET MUG,1,2011-03-01,3.29,,United Kingdom
563165,23346,SPACEBOY BEAKER,200,2011-08-12,1.08,14646.0,Netherlands
546976,22195,LARGE HEART MEASURING SPOONS,1,2011-03-18,3.29,,United Kingdom
558475,21619,4 VANILLA BOTANICAL CANDLES,2,2011-06-29,2.46,,United Kingdom
559465,84997A,CHILDRENS CUTLERY POLKADOT GREEN ,72,2011-07-08,3.75,14680.0,United Kingdom
577633,79321,CHILLI LIGHTS,4,2011-11-21,5.75,14194.0,United Kingdom
576236,23339,EGG FRYING PAN BLUE ,1,2011-11-14,2.08,13755.0,United Kingdom
544434,22299,PIG KEYRING WITH LIGHT & SOUND ,2,2011-02-18,2.46,,United Kingdom
570600,22138,BAKING SET 9 PIECE RETROSPOT ,12,2011-10-11,4.95,16076.0,United Kingdom
576830,23494,VINTAGE DOILY DELUXE SEWING KIT ,1,2011-11-16,5.95,14898.0,United Kingdom
568567,23353,6 GIFT TAGS VINTAGE CHRISTMAS ,1,2011-09-27,1.63,,United Kingdom
575607,22550,HOLIDAY FUN LUDO,1,2011-11-10,7.46,14096.0,United Kingdom
C579970,22840,ROUND CAKE TIN VINTAGE RED,-2,2011-12-01,7.95,14388.0,United Kingdom
576840,23322,LARGE WHITE HEART OF WICKER,1,2011-11-16,5.79,,United Kingdom
569223,21504,SKULLS GREETING CARD,12,2011-10-02,0.42,16283.0,United Kingdom
C569851,22384,LUNCH BAG PINK POLKADOT,-1,2011-10-06,1.45,17511.0,United Kingdom
561029,20724,RED RETROSPOT CHARLOTTE BAG,10,2011-07-24,0.85,12490.0,France
572292,22479,DAISY GARDEN MARKER,10,2011-10-23,1.25,16017.0,United Kingdom
572295,22991,GIRAFFE WOODEN RULER,2,2011-10-23,1.95,16686.0,United Kingdom
581217,23354,6 GIFT TAGS 50'S CHRISTMAS ,1,2011-12-08,1.63,,United Kingdom
579619,21174,POTTERING IN THE SHED METAL SIGN,12,2011-11-30,2.08,18241.0,United Kingdom
543201,22621,TRADITIONAL KNITTING NANCY,1,2011-02-04,2.92,,United Kingdom
538183,21949,SET OF 6 STRAWBERRY CHOPSTICKS,12,2010-12-10,1.25,16265.0,United Kingdom
547663,22498,WOODEN REGATTA BUNTING,2,2011-03-24,5.95,16022.0,United Kingdom
564733,20725,LUNCH BAG RED RETROSPOT,2,2011-08-28,1.65,17841.0,United Kingdom
574315,21232,STRAWBERRY CERAMIC TRINKET POT,72,2011-11-03,1.06,17076.0,United Kingdom
559092,21539,RED RETROSPOT BUTTER DISH,6,2011-07-06,4.95,16829.0,United Kingdom
579909,23109,PACK OF SIX LED TEA LIGHTS,1,2011-12-01,2.89,,United Kingdom
543805,22652,TRAVEL SEWING KIT,6,2011-02-13,1.65,17050.0,United Kingdom
564760,23124,18PC WOODEN CUTLERY SET DISPOSABLE,1,2011-08-30,2.46,,United Kingdom
565234,82483,WOOD 2 DRAWER CABINET WHITE FINISH,2,2011-09-02,6.95,,United Kingdom
578846,22633,HAND WARMER UNION JACK,3,2011-11-25,2.1,17757.0,United Kingdom
570796,85123A,WHITE HANGING HEART T-LIGHT HOLDER,2,2011-10-12,2.95,16241.0,United Kingdom
545475,22382,LUNCH BAG SPACEBOY DESIGN ,100,2011-03-03,1.45,12415.0,Australia
569215,22339,CHRISTMAS TREE PAINTED ZINC ,20,2011-10-02,0.19,13571.0,United Kingdom
572549,22090,PAPER BUNTING RETROSPOT,5,2011-10-24,5.79,,United Kingdom
573897,22599,CHRISTMAS MUSICAL ZINC STAR,30,2011-11-01,0.29,16729.0,United Kingdom
565836,23208,LUNCH BAG VINTAGE LEAF DESIGN,100,2011-09-07,1.45,17511.0,United Kingdom
C547905,M,Manual,-1,2011-03-28,416.75,,United Kingdom
560567,21671,RED SPOT CERAMIC DRAWER KNOB,2,2011-07-19,3.29,,United Kingdom
579301,21159,MOODY BOY  DOOR HANGER ,2,2011-11-29,0.39,18118.0,United Kingdom
551996,22077,6 RIBBONS RUSTIC CHARM,12,2011-05-05,1.65,16628.0,United Kingdom
545695,22979,PANTRY WASHING UP BRUSH,8,2011-03-06,1.45,17050.0,United Kingdom
556063,22384,LUNCH BAG PINK POLKADOT,2,2011-06-08,1.65,14587.0,United Kingdom
548542,22358,KINGS CHOICE TEA CADDY ,6,2011-03-31,2.95,13918.0,United Kingdom
549023,84978,HANGING HEART JAR T-LIGHT HOLDER,6,2011-04-05,2.46,,United Kingdom
556636,71143,SILVER BOOK MARK WITH BEADS,2,2011-06-13,0.83,,United Kingdom
562619,15056N,EDWARDIAN PARASOL NATURAL,2,2011-08-08,5.95,15311.0,United Kingdom
544297,47591D,PINK FAIRY CAKE CHILDRENS APRON,8,2011-02-17,1.95,14298.0,United Kingdom
556245,20963,APPLE BATH SPONGE,1,2011-06-09,1.25,17841.0,United Kingdom
570516,21507,ELEPHANT BIRTHDAY CARD ,12,2011-10-11,0.42,14121.0,United Kingdom
536592,85132A,CHARLIE + LOLA BISCUITS TINS,1,2010-12-01,8.47,,United Kingdom
580705,22895,SET OF 2 TEA TOWELS APPLE AND PEARS,12,2011-12-05,3.25,12683.0,France
575647,22112,CHOCOLATE HOT WATER BOTTLE,24,2011-11-10,4.25,16440.0,United Kingdom
546105,22554,PLASTERS IN TIN WOODLAND ANIMALS,1,2011-03-09,1.65,14662.0,United Kingdom
569496,22726,ALARM CLOCK BAKELIKE GREEN,4,2011-10-04,3.75,12395.0,Belgium
548212,22534,MAGIC DRAWING SLATE SPACEBOY ,24,2011-03-30,0.42,12456.0,Switzerland
580727,22364,GLASS JAR DIGESTIVE BISCUITS,1,2011-12-05,5.79,14096.0,United Kingdom
551468,85061W,WHITE JEWELLED HEART DECORATION,6,2011-04-28,1.63,,United Kingdom
540026,22322,BIRD DECORATION GREEN POLKADOT,11,2011-01-04,0.81,,United Kingdom
552186,21666,RIDGED GLASS T-LIGHT HOLDER,24,2011-05-06,0.65,12921.0,United Kingdom
565565,23190,BUNDLE OF 3 SCHOOL EXERCISE BOOKS  ,1,2011-09-05,1.65,14534.0,United Kingdom
558194,21086,SET/6 RED SPOTTY PAPER CUPS,3,2011-06-27,0.65,14583.0,United Kingdom
555560,22659,LUNCH BOX I LOVE LONDON,1,2011-06-05,1.95,17346.0,United Kingdom
548698,22501,PICNIC BASKET WICKER LARGE,1,2011-04-03,9.95,18109.0,United Kingdom
568400,23400,SHELF WITH 4 HOOKS HOME SWEET HOME,2,2011-09-27,6.25,13644.0,United Kingdom
537643,85048,15CM CHRISTMAS GLASS BALL 20 LIGHTS,1,2010-12-07,16.98,,United Kingdom
550474,22984,CARD GINGHAM ROSE ,1,2011-04-18,0.83,,United Kingdom
548308,21086,SET/6 RED SPOTTY PAPER CUPS,1,2011-03-30,0.65,17220.0,United Kingdom
576371,22340,NOEL GARLAND PAINTED ZINC ,24,2011-11-15,0.39,14911.0,EIRE
C551018,20719,WOODLAND CHARLOTTE BAG,-1,2011-04-26,0.85,12705.0,Germany
543040,21498,RED RETROSPOT WRAP ,25,2011-02-02,0.42,17337.0,United Kingdom
573484,21802,CHRISTMAS TREE HEART DECORATION,36,2011-10-31,0.42,14883.0,United Kingdom
546133,22745,POPPY'S PLAYHOUSE BEDROOM ,6,2011-03-09,2.1,14291.0,United Kingdom
570024,82583,HOT BATHS METAL SIGN,12,2011-10-07,2.1,17975.0,United Kingdom
543467,DOT,DOTCOM POSTAGE,1,2011-02-08,234.92,,United Kingdom
573585,22639,SET OF 4 NAPKIN CHARMS HEARTS,2,2011-10-31,4.96,,United Kingdom
541251,22469,HEART OF WICKER SMALL,5,2011-01-16,1.65,15046.0,United Kingdom
566294,23300,GARDENERS KNEELING PAD CUP OF TEA ,3,2011-09-11,1.65,15533.0,United Kingdom
548858,22087,PAPER BUNTING WHITE LACE,6,2011-04-04,2.95,14911.0,EIRE
C542060,20725,LUNCH BAG RED RETROSPOT,-2,2011-01-25,1.45,14680.0,United Kingdom
537395,21733,RED HANGING HEART T-LIGHT HOLDER,2,2010-12-06,2.95,15356.0,United Kingdom
555150,21900,"KEY FOB , SHED",1,2011-05-31,1.63,,United Kingdom
567943,23393,HOME SWEET HOME CUSHION COVER ,3,2011-09-22,3.75,14702.0,United Kingdom
541274,84997C,BLUE 3 PIECE POLKADOT CUTLERY SET,6,2011-01-17,3.75,15696.0,United Kingdom
568721,22067,CHOC TRUFFLE GOLD TRINKET POT ,1,2011-09-28,3.29,,United Kingdom
552461,22087,PAPER BUNTING WHITE LACE,12,2011-05-09,2.95,17723.0,United Kingdom
547788,22501,PICNIC BASKET WICKER LARGE,1,2011-03-25,20.79,,United Kingdom
558475,15058B,PINK POLKADOT GARDEN PARASOL,2,2011-06-29,10.79,,United Kingdom
564353,23312,VINTAGE CHRISTMAS GIFT SACK,4,2011-08-24,4.15,15764.0,United Kingdom
564719,22400,MAGNETS PACK OF 4 HOME SWEET HOME,3,2011-08-28,0.39,15325.0,United Kingdom
537332,22423,REGENCY CAKESTAND 3 TIER,2,2010-12-06,12.75,14344.0,United Kingdom
562024,23201,JUMBO BAG ALPHABET,2,2011-08-01,4.13,,United Kingdom
575070,22680,FRENCH BLUE METAL DOOR SIGN 5,1,2011-11-08,1.25,17841.0,United Kingdom
575074,23263,SET OF 3 WOODEN HEART DECORATIONS,2,2011-11-08,1.25,15356.0,United Kingdom
554960,21218,RED SPOTTY BISCUIT TIN,1,2011-05-27,8.29,,United Kingdom
568346,21524,DOORMAT SPOTTY HOME SWEET HOME,1,2011-09-26,16.63,14096.0,United Kingdom
541018,72802C,VANILLA SCENT CANDLE JEWELLED BOX,1,2011-01-13,4.25,14978.0,United Kingdom
566281,21446,12 RED ROSE PEG PLACE SETTINGS,6,2011-09-11,1.25,12748.0,United Kingdom
558430,20972,PINK CREAM FELT CRAFT TRINKET BOX ,12,2011-06-29,1.25,13238.0,United Kingdom
546159,85194L,HANGING SPRING FLOWER EGG LARGE,12,2011-03-10,0.85,16471.0,United Kingdom
563909,23341,PINK DINER WALL CLOCK,1,2011-08-21,8.5,15701.0,United Kingdom
556733,21162,TOXIC AREA  DOOR HANGER ,4,2011-06-14,1.45,16919.0,United Kingdom
537897,22454,MEASURING TAPE BABUSHKA RED,6,2010-12-09,2.95,12683.0,France
539590,22295,HEART FILIGREE DOVE LARGE,24,2010-12-20,1.65,14733.0,United Kingdom
553702,21181,PLEASE ONE PERSON METAL SIGN,3,2011-05-18,2.1,13263.0,United Kingdom
567184,23307,SET OF 60 PANTRY DESIGN CAKE CASES ,2,2011-09-18,0.55,16033.0,United Kingdom
570653,23013,GLASS APOTHECARY BOTTLE TONIC,1,2011-10-11,3.95,14710.0,United Kingdom
581476,22670,FRENCH WC SIGN BLUE METAL,24,2011-12-09,1.25,12433.0,Norway
580506,23562,SET OF 6 RIBBONS PERFECTLY PRETTY  ,6,2011-12-04,2.89,13319.0,United Kingdom
562371,22189,CREAM HEART CARD HOLDER,4,2011-08-04,3.95,13709.0,United Kingdom
576615,22467,GUMBALL COAT RACK,4,2011-11-15,2.55,17231.0,United Kingdom
563697,22378,WALL TIDY RETROSPOT ,2,2011-08-18,2.1,16813.0,United Kingdom
573151,23309,SET OF 60 I LOVE LONDON CAKE CASES ,6,2011-10-27,0.55,17602.0,United Kingdom
541215,20727,LUNCH BAG  BLACK SKULL.,10,2011-01-14,1.65,14329.0,United Kingdom
548708,22428,ENAMEL FIRE BUCKET CREAM,2,2011-04-03,6.95,13269.0,United Kingdom
576513,22435,SET OF 9 HEART SHAPED BALLOONS,3,2011-11-15,1.25,14715.0,United Kingdom
539754,47566,PARTY BUNTING,1,2010-12-21,4.65,12748.0,United Kingdom
540255,15034,PAPER POCKET TRAVELING FAN ,1,2011-01-05,0.85,,United Kingdom
546255,82581,TOILET METAL SIGN,12,2011-03-10,0.55,13468.0,United Kingdom
580727,84946,ANTIQUE SILVER T-LIGHT GLASS,7,2011-12-05,2.46,14096.0,United Kingdom
570797,23165,LARGE CERAMIC TOP STORAGE JAR,48,2011-10-12,1.45,15311.0,United Kingdom
542215,21673,WHITE SPOT BLUE CERAMIC DRAWER KNOB,12,2011-01-26,1.25,12472.0,Germany
540971,22631,CIRCUS PARADE LUNCH BOX ,12,2011-01-12,1.95,12383.0,Belgium
574530,20727,LUNCH BAG  BLACK SKULL.,1,2011-11-04,1.65,16887.0,United Kingdom
543053,20941,FROG CANDLE,12,2011-02-03,1.25,17362.0,United Kingdom
549732,22499,WOODEN UNION JACK BUNTING,12,2011-04-11,5.95,15615.0,United Kingdom
564835,20685,DOORMAT RED RETROSPOT,1,2011-08-30,15.79,,United Kingdom
575972,21561,DINOSAUR LUNCH BOX WITH CUTLERY,2,2011-11-13,2.55,14499.0,United Kingdom
569232,20974,12 PENCILS SMALL TUBE SKULL,5,2011-10-02,0.65,16667.0,United Kingdom
565234,21787,RAIN PONCHO RETROSPOT,2,2011-09-02,1.63,,United Kingdom
570103,23203,JUMBO BAG VINTAGE DOILY ,6,2011-10-07,2.08,15719.0,United Kingdom
547248,47566,PARTY BUNTING,1,2011-03-22,10.79,,United Kingdom
555565,22037,ROBOT BIRTHDAY CARD,12,2011-06-05,0.42,15298.0,United Kingdom
547055,22384,LUNCH BAG PINK POLKADOT,3,2011-03-20,1.65,16444.0,United Kingdom
559052,82613A,"METAL SIGN,CUPCAKE SINGLE HOOK",1,2011-07-05,2.46,,United Kingdom
549118,85227,SET OF 6 3D KIT CARDS FOR KIDS,12,2011-04-06,0.85,14911.0,EIRE
536876,21891,TRADITIONAL WOODEN SKIPPING ROPE,4,2010-12-03,2.51,,United Kingdom
