InvoiceNo,StockCode,Description,Quantity,InvoiceDate,UnitPrice,CustomerID,Country
538077,48184,DOORMAT ENGLISH ROSE ,2,2010-12-09,7.95,14667.0,United Kingdom
578067,23452,HEART MINI PORTRAIT FRAME,1,2011-11-22,4.13,,United Kingdom
554992,22431,WATERING CAN BLUE ELEPHANT,1,2011-05-29,1.95,16686.0,United Kingdom
559834,22487,WHITE WOOD GARDEN PLANT LADDER,1,2011-07-13,9.95,12576.0,Poland
563621,22297,HEART IVORY TRELLIS SMALL,24,2011-08-18,1.25,13113.0,United Kingdom
546537,23007, SPACEBOY BABY GIFT SET,1,2011-03-14,16.95,15005.0,United Kingdom
576644,23355,HOT WATER BOTTLE KEEP CALM,3,2011-11-16,8.29,,United Kingdom
552038,20979,36 PENCILS TUBE RED RETROSPOT,64,2011-05-06,1.25,14156.0,EIRE
547664,84970L,SINGLE HEART ZINC T-LIGHT HOLDER,6,2011-03-24,0.95,13069.0,United Kingdom
561056,21065,BOOM BOX SPEAKER GIRLS,2,2011-07-24,5.95,13477.0,United Kingdom
566581,22219,LOVEBIRD HANGING DECORATION WHITE ,10,2011-09-13,0.85,16081.0,United Kingdom
561214,23209,LUNCH BAG DOILEY PATTERN ,1,2011-07-25,4.13,,United Kingdom
572751,23271,CHRISTMAS TABLE SILVER CANDLE SPIKE,16,2011-10-25,0.83,17449.0,United Kingdom
561894,22602,RETROSPOT WOODEN HEART DECORATION,1,2011-07-31,0.85,14456.0,United Kingdom
541566,21200,MULTICOLOUR HONEYCOMB PAPER GARLAND,48,2011-01-19,0.65,17722.0,United Kingdom
548952,22659,LUNCH BOX I LOVE LONDON,3,2011-04-05,1.95,15572.0,United Kingdom
555158,21982,PACK OF 12 SUKI TISSUES ,24,2011-06-01,0.29,14842.0,United Kingdom
573921,22430,ENAMEL WATERING CAN CREAM,4,2011-11-02,4.95,16352.0,United Kingdom
546509,21108,FAIRY CAKE FLANNEL ASSORTED COLOUR,9,2011-03-14,2.55,14911.0,EIRE
569214,15034,PAPER POCKET TRAVELING FAN ,1200,2011-10-02,0.07,14533.0,United Kingdom
574547,23190,BUNDLE OF 3 SCHOOL EXERCISE BOOKS  ,1,2011-11-04,1.65,17841.0,United Kingdom
544214,47559b,TEA TIME OVEN GLOVE,2,2011-02-17,3.29,,United Kingdom
558812,21899,"KEY FOB , GARAGE DESIGN",24,2011-07-04,0.65,16265.0,United Kingdom
543533,22364,GLASS JAR DIGESTIVE BISCUITS,1,2011-02-09,5.79,,United Kingdom
538135,21186,,2,2010-12-09,0.0,,United Kingdom
558375,22629,SPACEBOY LUNCH BOX ,12,2011-06-28,1.95,13418.0,United Kingdom
578833,22721,SET OF 3 CAKE TINS SKETCHBOOK,2,2011-11-25,10.79,,United Kingdom
570087,23208,LUNCH BAG VINTAGE LEAF DESIGN,1,2011-10-07,4.96,,United Kingdom
558240,23163,REGENCY SUGAR TONGS,1,2011-06-27,4.96,,United Kingdom
551809,47590A,BLUE HAPPY BIRTHDAY BUNTING,50,2011-05-04,4.65,17511.0,United Kingdom
545585,21122,SET/10 PINK POLKADOT PARTY CANDLES,24,2011-03-04,1.25,12541.0,Spain
558686,21669,BLUE STRIPE CERAMIC DRAWER KNOB,12,2011-07-01,1.25,17706.0,United Kingdom
575477,21739,COSY SLIPPER SHOES SMALL GREEN,2,2011-11-09,2.46,,United Kingdom
579673,20726,LUNCH BAG WOODLAND,2,2011-11-30,1.65,18283.0,United Kingdom
563179,22383,LUNCH BAG SUKI DESIGN ,10,2011-08-12,1.65,12431.0,Australia
576618,22357,KINGS CHOICE BISCUIT TIN,1,2011-11-15,4.13,,United Kingdom
548714,22429,ENAMEL MEASURING JUG CREAM,1,2011-04-03,4.25,17337.0,United Kingdom
563016,22078,RIBBON REEL LACE DESIGN ,10,2011-08-11,2.1,15358.0,United Kingdom
541592,22969,HOMEMADE JAM SCENTED CANDLES,1,2011-01-19,3.29,,United Kingdom
538991,22257,FELT FARM ANIMAL SHEEP,144,2010-12-15,0.42,17511.0,United Kingdom
579694,23175,REGENCY MILK JUG PINK ,2,2011-11-30,7.46,,United Kingdom
574074,23182,TOILET SIGN OCCUPIED OR VACANT,4,2011-11-02,2.46,,United Kingdom
559202,84912A,PINK ROSE WASHBAG,4,2011-07-07,3.75,13583.0,United Kingdom
571064,23192,BUNDLE OF 3 ALPHABET EXERCISE BOOKS,1,2011-10-13,1.65,17181.0,United Kingdom
562717,23316,RED REFECTORY CLOCK ,1,2011-08-08,19.96,,United Kingdom
550953,85199S,SMALL HANGING IVORY/RED WOOD BIRD,1,2011-04-21,0.83,,United Kingdom
581219,22566,FELTCRAFT HAIRBAND PINK AND PURPLE,1,2011-12-08,1.63,,United Kingdom
573505,85208,check,-22,2011-10-31,0.0,,United Kingdom
566249,84879,ASSORTED COLOUR BIRD ORNAMENT,8,2011-09-11,1.69,13527.0,United Kingdom
580294,23354,6 GIFT TAGS 50'S CHRISTMAS ,7,2011-12-02,0.83,17364.0,United Kingdom
542556,22143,,-1,2011-01-28,0.0,,United Kingdom
580958,23084,RABBIT NIGHT LIGHT,1,2011-12-06,2.08,17266.0,United Kingdom
559106,23004,TRAVEL CARD WALLET PANTRY,2,2011-07-06,0.42,15889.0,United Kingdom
573868,21156,RETROSPOT CHILDRENS APRON,8,2011-11-01,1.95,12491.0,France
560777,21078,SET/20 STRAWBERRY PAPER NAPKINS ,1,2011-07-21,2.46,,United Kingdom
551997,22855,FINE WICKER HEART ,1,2011-05-05,2.46,,United Kingdom
554845,82600,NO SINGING METAL SIGN,48,2011-05-26,2.21,17450.0,United Kingdom
563580,23007, SPACEBOY BABY GIFT SET,1,2011-08-17,16.95,16706.0,United Kingdom
577319,23309,SET OF 60 I LOVE LONDON CAKE CASES ,2,2011-11-18,0.55,17301.0,United Kingdom
547386,22951,60 CAKE CASES DOLLY GIRL DESIGN,1,2011-03-22,1.25,,United Kingdom
573888,20718,RED RETROSPOT SHOPPER BAG,30,2011-11-01,1.25,17696.0,United Kingdom
574709,23500,KEY RING BASEBALL BOOT ASSORTED ,40,2011-11-06,1.25,17768.0,United Kingdom
550347,22432,WATERING CAN PINK BUNNY,6,2011-04-18,1.95,14227.0,United Kingdom
581023,22952,60 CAKE CASES VINTAGE CHRISTMAS,13,2011-12-07,1.25,,United Kingdom
562967,22333,RETROSPOT PARTY BAG + STICKER SET,48,2011-08-11,1.45,16422.0,United Kingdom
564161,16169E,WRAP 50'S  CHRISTMAS,25,2011-08-23,0.42,14523.0,United Kingdom
579282,82494L,WOODEN FRAME ANTIQUE WHITE ,12,2011-11-29,2.95,16818.0,United Kingdom
552659,22895,SET OF 2 TEA TOWELS APPLE AND PEARS,1,2011-05-10,6.63,,United Kingdom
544087,22972,CHILDREN'S SPACEBOY MUG,2,2011-02-15,1.65,17530.0,United Kingdom
544916,22983,CARD BILLBOARD FONT,12,2011-02-24,0.42,17377.0,United Kingdom
555247,22386,JUMBO BAG PINK POLKADOT,20,2011-06-01,2.08,14315.0,United Kingdom
579187,22784,LANTERN CREAM GAZEBO ,1,2011-11-28,10.79,,United Kingdom
580956,23242,TREASURE TIN BUFFALO BILL ,1,2011-12-06,2.08,17841.0,United Kingdom
558119,22629,SPACEBOY LUNCH BOX ,1,2011-06-27,2.46,,United Kingdom
543990,22819,"BIRTHDAY CARD, RETRO SPOT",12,2011-02-15,0.42,15122.0,United Kingdom
537262,22382,LUNCH BAG SPACEBOY DESIGN ,1,2010-12-06,1.65,15039.0,United Kingdom
556179,22028,PENNY FARTHING BIRTHDAY CARD,36,2011-06-09,0.42,13756.0,United Kingdom
553894,23050,RECYCLED ACAPULCO MAT GREEN,2,2011-05-19,8.25,13658.0,United Kingdom
581167,20728,LUNCH BAG CARS BLUE,10,2011-12-07,1.65,13534.0,United Kingdom
567611,23300,GARDENERS KNEELING PAD CUP OF TEA ,24,2011-09-21,1.65,16076.0,United Kingdom
549720,22227,HANGING HEART MIRROR DECORATION ,1,2011-04-11,0.65,14606.0,United Kingdom
540551,82613B,"METAL SIGN,CUPCAKE SINGLE HOOK",8,2011-01-10,0.85,,United Kingdom
577695,21530,DAIRY MAID TOASTRACK,2,2011-11-21,0.79,15645.0,United Kingdom
573585,22068,BLACK PIRATE TREASURE CHEST,1,2011-10-31,3.29,,United Kingdom
562984,21481,FAWN BLUE HOT WATER BOTTLE,3,2011-08-11,2.95,17841.0,United Kingdom
539958,21027,NINJA RABBIT PINK,3,2010-12-23,0.85,,United Kingdom
575305,23203,JUMBO BAG VINTAGE DOILY ,20,2011-11-09,2.08,14188.0,United Kingdom
579098,85175,CACTI T-LIGHT CANDLES,16,2011-11-28,0.42,14606.0,United Kingdom
565149,20992,JAZZ HEARTS PURSE NOTEBOOK,24,2011-09-01,0.39,14414.0,United Kingdom
536796,22952,60 CAKE CASES VINTAGE CHRISTMAS,1,2010-12-02,0.55,15574.0,United Kingdom
538999,22086,PAPER CHAIN KIT 50'S CHRISTMAS ,6,2010-12-15,2.95,16003.0,United Kingdom
544800,21212,PACK OF 72 RETROSPOT CAKE CASES,24,2011-02-23,0.55,15687.0,United Kingdom
561005,23125,6PC WOOD PLATE SET DISPOSABLE,10,2011-07-22,1.25,17961.0,United Kingdom
548148,22616,PACK OF 12 LONDON TISSUES ,3,2011-03-29,0.29,17931.0,United Kingdom
545333,21688,SILVER PLATE CANDLE BOWL SMALL,1,2011-03-01,5.79,,United Kingdom
546107,22021,BLUE FELT EASTER EGG BASKET,3,2011-03-09,1.65,17238.0,United Kingdom
561863,21495,SKULLS AND CROSSBONES WRAP,25,2011-07-31,0.42,17695.0,United Kingdom
551340,22381,TOY TIDY PINK POLKADOT,1,2011-04-27,4.13,,United Kingdom
537823,84946,ANTIQUE SILVER TEA GLASS ETCHED,46,2010-12-08,1.25,,United Kingdom
550906,21530,DAIRY MAID TOASTRACK,18,2011-04-21,0.79,14298.0,United Kingdom
562282,23208,LUNCH BAG VINTAGE LEAF DESIGN,30,2011-08-04,1.65,13098.0,United Kingdom
558475,20733,GOLD MINI TAPE MEASURE ,4,2011-06-29,0.83,,United Kingdom
579399,22372,AIRLINE BAG VINTAGE WORLD CHAMPION ,1,2011-11-29,4.25,13137.0,United Kingdom
566060,35646,VINTAGE BEAD PINK EVENING BAG,1,2011-09-08,2.46,,United Kingdom
562980,23319,BOX OF 6 MINI 50'S CRACKERS,12,2011-08-11,2.49,17686.0,United Kingdom
541695,21672,WHITE SPOT RED CERAMIC DRAWER KNOB,29,2011-01-20,2.46,,United Kingdom
566042,23182,TOILET SIGN OCCUPIED OR VACANT,1,2011-09-08,0.83,17811.0,United Kingdom
580136,22592,CARDHOLDER HOLLY WREATH METAL,1,2011-12-01,3.75,17841.0,United Kingdom
540514,82482,WOODEN PICTURE FRAME WHITE FINISH,6,2011-01-09,2.55,15708.0,United Kingdom
555485,21533,RETROSPOT LARGE MILK JUG,3,2011-06-03,4.95,17722.0,United Kingdom
580678,21411,GINGHAM HEART  DOORSTOP RED,4,2011-12-05,1.95,18015.0,United Kingdom
570465,21934,SKULL SHOULDER BAG,6,2011-10-10,1.63,,United Kingdom
580536,20719,WOODLAND CHARLOTTE BAG,10,2011-12-04,0.85,12490.0,France
551136,20676,RED RETROSPOT BOWL,8,2011-04-26,1.25,15301.0,United Kingdom
546364,85049D,BRIGHT BLUES RIBBONS ,1,2011-03-11,1.25,,United Kingdom
538108,22082,RIBBON REEL STRIPES DESIGN ,10,2010-12-09,1.65,17456.0,United Kingdom
566669,23359,SET OF 12 T-LIGHTS VINTAGE DOILEY,12,2011-09-14,1.95,18065.0,United Kingdom
581253,23427,STOOL HOME SWEET HOME ,1,2011-12-08,12.5,16891.0,United Kingdom
537237,22974,CHILDRENS DOLLY GIRL MUG,1,2010-12-06,3.36,,United Kingdom
556910,21723,ALPHABET HEARTS STICKER SHEET,6,2011-06-15,0.85,12748.0,United Kingdom
540977,84520B,PACK 20 ENGLISH ROSE PAPER NAPKINS,2,2011-01-12,1.66,,United Kingdom
555921,21078,SET/20 STRAWBERRY PAPER NAPKINS ,12,2011-06-07,0.85,15449.0,United Kingdom
564135,22433,WATERING CAN GREEN DINOSAUR,2,2011-08-23,1.95,16550.0,United Kingdom
568692,22867,HAND WARMER BIRD DESIGN,12,2011-09-28,2.1,13901.0,United Kingdom
564756,22201,FRYING PAN BLUE POLKADOT,1,2011-08-30,8.29,,United Kingdom
547822,21535,RED RETROSPOT SMALL MILK JUG,6,2011-03-25,2.55,12668.0,Germany
536528,85114B,IVORY ENCHANTED FOREST PLACEMAT,1,2010-12-01,1.65,15525.0,United Kingdom
568208,22909,SET OF 20 VINTAGE CHRISTMAS NAPKINS,12,2011-09-25,0.85,12783.0,Portugal
540821,22376,AIRLINE BAG VINTAGE JET SET WHITE,1,2011-01-11,4.21,,United Kingdom
574721,22947,WOODEN ADVENT CALENDAR RED,1,2011-11-06,7.95,17920.0,United Kingdom
545343,21259,VICTORIAN SEWING BOX SMALL ,2,2011-03-02,5.95,15733.0,United Kingdom
559816,20996,JAZZ HEARTS ADDRESS BOOK,2,2011-07-12,0.42,,United Kingdom
563930,85123A,WHITE HANGING HEART T-LIGHT HOLDER,1,2011-08-21,2.95,,United Kingdom
545213,22321,BIRD DECORATION RED RETROSPOT,12,2011-02-28,0.85,16518.0,United Kingdom
568716,22449,SILK PURSE BABUSHKA PINK,2,2011-09-28,2.46,,United Kingdom
574088,22423,REGENCY CAKESTAND 3 TIER,6,2011-11-03,12.75,18044.0,United Kingdom
565915,21915,RED  HARMONICA IN BOX ,3,2011-09-07,1.25,15752.0,United Kingdom
569678,21034,REX CASH+CARRY JUMBO SHOPPER,2,2011-10-05,0.95,17816.0,United Kingdom
571679,23004,TRAVEL CARD WALLET PANTRY,2,2011-10-18,0.42,14159.0,United Kingdom
563549,84992,72 SWEETHEART FAIRY CAKE CASES,1,2011-08-17,2.08,,United Kingdom
559539,21206,STRAWBERRY HONEYCOMB  GARLAND ,2,2011-07-10,1.65,18024.0,United Kingdom
573576,21787,RAIN PONCHO RETROSPOT,4,2011-10-31,1.63,14096.0,United Kingdom
581498,22141,CHRISTMAS CRAFT TREE TOP ANGEL,7,2011-12-09,4.13,,United Kingdom
550144,21559,STRAWBERRY LUNCH BOX WITH CUTLERY,2,2011-04-14,2.55,16520.0,United Kingdom
569904,22652,TRAVEL SEWING KIT,10,2011-10-06,1.65,13023.0,United Kingdom
561820,84596F,SMALL MARSHMALLOWS PINK BOWL,2,2011-07-29,0.83,,United Kingdom
543770,22281,EASTER TREE YELLOW BIRDS,2,2011-02-11,5.95,13875.0,United Kingdom
538524,22169,FAMILY ALBUM WHITE PICTURE FRAME,1,2010-12-13,16.98,,United Kingdom
576941,23583,LUNCH BAG PAISLEY PARK  ,10,2011-11-17,1.65,12562.0,France
580124,22617,BAKING SET SPACEBOY DESIGN,3,2011-12-01,4.95,,EIRE
538379,21378,SMALL TALL CAMPHOR WOOD TOADSTOOL,6,2010-12-12,1.65,17126.0,United Kingdom
578977,22154,ANGEL DECORATION 3 BUTTONS ,8,2011-11-27,0.42,17231.0,United Kingdom
576379,23491,VINTAGE JINGLE BELLS HEART,2,2011-11-15,8.25,16423.0,United Kingdom
554812,23199,JUMBO BAG APPLES,3,2011-05-26,2.08,15005.0,United Kingdom
536988,22075,6 RIBBONS ELEGANT CHRISTMAS ,3,2010-12-03,1.65,17238.0,United Kingdom
577497,21328,BALLOONS  WRITING SET ,2,2011-11-20,1.65,17555.0,United Kingdom
560716,22675,FRENCH KITCHEN SIGN BLUE METAL,12,2011-07-20,1.25,17675.0,United Kingdom
537772,22898,CHILDRENS APRON APPLES DESIGN,2,2010-12-08,1.95,18043.0,United Kingdom
559134,22988,SOLDIERS EGG CUP ,12,2011-07-06,1.25,12700.0,France
566200,22197,POPCORN HOLDER,2,2011-09-09,0.85,16910.0,United Kingdom
539958,22257,FELT FARM ANIMAL SHEEP,1,2010-12-23,0.85,,United Kingdom
536382,22839,3 TIER CAKE TIN GREEN AND CREAM,2,2010-12-01,14.95,16098.0,United Kingdom
568650,23236,STORAGE TIN VINTAGE DOILY ,6,2011-09-28,2.89,13505.0,Switzerland
543399,85188A,GREEN METAL SWINGING BUNNY,1,2011-02-08,1.63,,United Kingdom
569870,23388,WOODLAND MINI BACKPACK,2,2011-10-06,4.15,12757.0,Portugal
579471,22839,3 TIER CAKE TIN GREEN AND CREAM,1,2011-11-29,29.17,,United Kingdom
549835,85123A,WHITE HANGING HEART T-LIGHT HOLDER,32,2011-04-12,2.55,17511.0,United Kingdom
568206,23550,WRAP ALPHABET POSTER  ,50,2011-09-25,0.42,14806.0,United Kingdom
558330,21035,SET/2 RED RETROSPOT TEA TOWELS ,3,2011-06-28,3.25,12748.0,United Kingdom
553461,71459,HANGING JAM JAR T-LIGHT HOLDER,12,2011-05-17,0.85,16316.0,United Kingdom
544893,21976,PACK OF 60 MUSHROOM CAKE CASES,24,2011-02-24,0.55,17865.0,United Kingdom
561933,22671,FRENCH LAUNDRY SIGN BLUE METAL,12,2011-08-01,1.65,12949.0,United Kingdom
568712,21669,BLUE STRIPE CERAMIC DRAWER KNOB,6,2011-09-28,1.45,17841.0,United Kingdom
574240,22470,HEART OF WICKER LARGE,1,2011-11-03,2.95,15998.0,United Kingdom
572280,23204,CHARLOTTE BAG APPLES DESIGN,2,2011-10-23,0.85,16007.0,United Kingdom
540021,84536A,ENGLISH ROSE NOTEBOOK A7 SIZE,5,2011-01-04,0.42,17841.0,United Kingdom
563755,21137,BLACK RECORD COVER FRAME,4,2011-08-19,3.75,17612.0,United Kingdom
568193,23206,LUNCH BAG APPLE DESIGN,10,2011-09-25,1.65,17107.0,United Kingdom
577519,23046,PAPER LANTERN 9 POINT DELUXE STAR,2,2011-11-20,6.65,15044.0,United Kingdom
539404,22093,MOTORING TISSUE BOX,1,2010-12-17,1.25,17315.0,United Kingdom
547497,22916,HERB MARKER THYME,12,2011-03-23,0.65,14461.0,United Kingdom
575985,20974,12 PENCILS SMALL TUBE SKULL,2,2011-11-13,0.65,17841.0,United Kingdom
569847,22349,DOG BOWL CHASING BALL DESIGN,6,2011-10-06,3.75,14116.0,United Kingdom
539492,22616,PACK OF 12 LONDON TISSUES ,1,2010-12-20,0.85,,United Kingdom
562264,22147,FELTCRAFT BUTTERFLY HEARTS,1,2011-08-03,3.29,,United Kingdom
565411,23245,SET OF 3 REGENCY CAKE TINS,2,2011-09-04,4.95,13772.0,United Kingdom
549578,22728,ALARM CLOCK BAKELIKE PINK,4,2011-04-11,3.75,17340.0,United Kingdom
574856,22077,6 RIBBONS RUSTIC CHARM,3,2011-11-07,4.13,,United Kingdom
575337,23439,HAND WARMER RED LOVE HEART,2,2011-11-09,2.1,17867.0,United Kingdom
577504,84842,HELLO SAILOR BATHROOM SET,1,2011-11-20,3.75,14159.0,United Kingdom
538210,21238,RED RETROSPOT CUP,8,2010-12-10,0.85,14256.0,United Kingdom
557572,22558,CLOTHES PEGS RETROSPOT PACK 24 ,24,2011-06-21,1.45,15061.0,United Kingdom
553720,48173C,DOORMAT BLACK FLOCK ,4,2011-05-18,7.95,13417.0,United Kingdom
C541710,21874,GIN AND TONIC MUG,-3,2011-01-21,1.25,14320.0,United Kingdom
564962,47504H,ENGLISH ROSE SPIRIT LEVEL ,2,2011-08-31,0.79,17777.0,United Kingdom
552676,22468,BABUSHKA LIGHTS STRING OF 10,1,2011-05-10,13.29,,United Kingdom
559710,23205,CHARLOTTE BAG VINTAGE ALPHABET ,20,2011-07-12,0.85,12474.0,Germany
538201,22141,CHRISTMAS CRAFT TREE TOP ANGEL,1,2010-12-10,2.1,15723.0,United Kingdom
581429,21755,LOVE BUILDING BLOCK WORD,3,2011-12-08,6.25,16322.0,United Kingdom
563100,21314,SMALL GLASS HEART TRINKET POT,8,2011-08-12,2.1,12381.0,Norway
556479,23007, SPACEBOY BABY GIFT SET,1,2011-06-12,16.95,16983.0,United Kingdom
565917,22418,10 COLOUR SPACEBOY PEN,1,2011-09-07,1.63,,United Kingdom
555202,84536B,FAIRY CAKES NOTEBOOK A7 SIZE,2,2011-06-01,0.42,16813.0,United Kingdom
537781,21865,PINK UNION JACK  PASSPORT COVER ,1,2010-12-08,2.1,17341.0,United Kingdom
537689,82494L,WOODEN FRAME ANTIQUE WHITE ,6,2010-12-08,2.95,15750.0,United Kingdom
560225,20725,LUNCH BAG RED RETROSPOT,1,2011-07-15,4.13,,United Kingdom
550057,82580,BATHROOM METAL SIGN,2,2011-04-14,0.55,14606.0,United Kingdom
578289,22514,CHILDS GARDEN SPADE BLUE,1,2011-11-23,2.1,17841.0,United Kingdom
575661,22079,RIBBON REEL HEARTS DESIGN ,10,2011-11-10,1.65,12617.0,France
C543749,M,Manual,-1,2011-02-11,71.46,13672.0,United Kingdom
569897,22620,4 TRADITIONAL SPINNING TOPS,2,2011-10-06,1.45,17813.0,United Kingdom
548718,21908,CHOCOLATE THIS WAY METAL SIGN,144,2011-04-04,1.85,14156.0,EIRE
572681,23307,SET OF 60 PANTRY DESIGN CAKE CASES ,24,2011-10-25,0.55,13510.0,United Kingdom
567901,21174,POTTERING IN THE SHED METAL SIGN,1,2011-09-22,4.13,,United Kingdom
566571,23295,SET OF 12 MINI LOAF BAKING CASES,8,2011-09-13,0.83,17037.0,United Kingdom
566399,82600,NO SINGING METAL SIGN,12,2011-09-12,2.1,16141.0,United Kingdom
574475,16218,CARTOON  PENCIL SHARPENERS,80,2011-11-04,0.06,14132.0,United Kingdom
547712,84358,FLOOR LAMP SHADE WOOD BASE,4,2011-03-24,8.49,16905.0,United Kingdom
563032,22090,PAPER BUNTING RETROSPOT,6,2011-08-11,2.95,16076.0,United Kingdom
557305,82494L,WOODEN FRAME ANTIQUE WHITE ,1,2011-06-19,2.95,13568.0,United Kingdom
577396,22938,CUPCAKE LACE PAPER SET 6,12,2011-11-18,1.95,17621.0,United Kingdom
553668,22366,DOORMAT AIRMAIL ,2,2011-05-18,7.95,13993.0,United Kingdom
571328,21724,PANDA AND BUNNIES STICKER SHEET,12,2011-10-17,0.85,12473.0,Germany
553220,84879,ASSORTED COLOUR BIRD ORNAMENT,24,2011-05-16,1.69,13319.0,United Kingdom
575875,22814,CARD PARTY GAMES ,6,2011-11-11,0.42,,United Kingdom
548500,21355,TOAST ITS - I LOVE YOU ,4,2011-03-31,1.25,17071.0,United Kingdom
572103,21821,GLITTER STAR GARLAND WITH BELLS ,1,2011-10-20,3.75,17571.0,United Kingdom
549813,21706,FOLDING UMBRELLA RED/WHITE POLKADOT,1,2011-04-12,4.95,17972.0,United Kingdom
567533,23313,VINTAGE CHRISTMAS BUNTING,5,2011-09-21,4.95,17651.0,United Kingdom
537464,22570,FELTCRAFT CUSHION RABBIT,4,2010-12-07,3.75,14907.0,United Kingdom
554792,21080,SET/20 RED RETROSPOT PAPER NAPKINS ,24,2011-05-26,0.85,12547.0,Spain
571289,23169,CLASSIC GLASS COOKIE JAR,5,2011-10-16,4.15,15113.0,United Kingdom
550471,22494,EMERGENCY FIRST AID TIN ,1,2011-04-18,2.46,,United Kingdom
570019,22063,CERAMIC BOWL WITH STRAWBERRY DESIGN,1,2011-10-07,2.95,17841.0,United Kingdom
562417,20717,STRAWBERRY SHOPPER BAG,1,2011-08-04,2.46,,United Kingdom
568992,20754,RETROSPOT RED WASHING UP GLOVES,1,2011-09-29,2.1,17218.0,United Kingdom
544802,84688,BEACH HUT DESIGN BLACKBOARD,6,2011-02-23,4.25,13149.0,United Kingdom
570492,23083,SET 6 PAPER TABLE LANTERN STARS ,6,2011-10-11,3.75,14194.0,United Kingdom
579508,85049A,TRADITIONAL CHRISTMAS RIBBONS,1,2011-11-29,2.46,,United Kingdom
544115,21086,SET/6 RED SPOTTY PAPER CUPS,12,2011-02-16,0.65,12727.0,France
546648,21989,PACK OF 20 SKULL PAPER NAPKINS,5,2011-03-15,1.63,,United Kingdom
544461,21672,WHITE SPOT RED CERAMIC DRAWER KNOB,6,2011-02-20,1.25,13744.0,United Kingdom
564312,84997A,CHILDRENS CUTLERY POLKADOT GREEN ,72,2011-08-24,3.75,15769.0,United Kingdom
542664,21563,RED HEART SHAPE LOVE BUCKET ,1,2011-01-31,5.79,,United Kingdom
546136,21992,VINTAGE PAISLEY STATIONERY SET,1,2011-03-09,2.46,,United Kingdom
550820,22796,PHOTO FRAME 3 CLASSIC HANGING,4,2011-04-21,9.95,13148.0,United Kingdom
577906,M,Manual,76,2011-11-22,0.29,13268.0,United Kingdom
574561,22074,6 RIBBONS SHIMMERING PINKS ,1,2011-11-04,1.25,,United Kingdom
560364,21078,SET/20 STRAWBERRY PAPER NAPKINS ,24,2011-07-18,0.85,16705.0,United Kingdom
572037,22090,PAPER BUNTING RETROSPOT,3,2011-10-20,2.95,17365.0,United Kingdom
559128,21463,MIRRORED DISCO BALL ,1,2011-07-06,5.95,17238.0,United Kingdom
553199,85175,CACTI T-LIGHT CANDLES,16,2011-05-15,0.42,17758.0,United Kingdom
576676,22423,REGENCY CAKESTAND 3 TIER,1,2011-11-16,12.75,16855.0,United Kingdom
566633,23238,SET OF 4 KNICK KNACK TINS LONDON ,24,2011-09-14,4.15,17193.0,United Kingdom
560772,37340,MULTICOLOUR SPRING FLOWER MUG,6,2011-07-20,0.69,,United Kingdom
564727,85169B,BLACK LOVE BIRD CANDLE,2,2011-08-28,1.25,16686.0,United Kingdom
562602,23255,CHILDRENS CUTLERY CIRCUS PARADE,8,2011-08-08,4.15,12865.0,Austria
543277,21868,POTTING SHED TEA MUG,6,2011-02-06,1.25,15808.0,United Kingdom
560240,84580,MOUSE TOY WITH PINK T-SHIRT,2,2011-07-17,3.75,15716.0,United Kingdom
553347,21621,VINTAGE UNION JACK BUNTING,4,2011-05-16,8.5,14755.0,United Kingdom
543800,85205B,PINK FELT EASTER RABBIT GARLAND,2,2011-02-13,2.55,17282.0,United Kingdom
576840,20677,PINK POLKADOT BOWL,1,2011-11-16,2.46,,United Kingdom
568070,23340,VINTAGE CHRISTMAS CAKE FRILL,12,2011-09-23,1.65,16128.0,United Kingdom
542584,21041,RED RETROSPOT OVEN GLOVE DOUBLE,2,2011-01-28,2.95,18016.0,United Kingdom
539837,22692,DOORMAT WELCOME TO OUR HOME,1,2010-12-22,7.95,14532.0,United Kingdom
552232,22679,FRENCH BLUE METAL DOOR SIGN 4,1,2011-05-06,2.46,,United Kingdom
556879,22746,POPPY'S PLAYHOUSE LIVINGROOM ,1,2011-06-15,2.1,16461.0,United Kingdom
541684,22519,CHILDS GARDEN BRUSH PINK,3,2011-01-20,2.1,15498.0,United Kingdom
571425,22111,SCOTTIE DOG HOT WATER BOTTLE,3,2011-10-17,4.95,14911.0,EIRE
539488,22540,MINI JIGSAW CIRCUS PARADE ,24,2010-12-20,0.42,12377.0,Switzerland
576251,22822,CREAM WALL PLANTER HEART SHAPED,4,2011-11-14,5.95,16207.0,United Kingdom
558774,23241,TREASURE TIN GYMKHANA DESIGN,1,2011-07-04,4.13,,United Kingdom
561653,22099,CARAVAN SQUARE TISSUE BOX,36,2011-07-28,0.39,14002.0,United Kingdom
538524,22961,JAM MAKING SET PRINTED,12,2010-12-13,3.36,,United Kingdom
577078,20728,LUNCH BAG CARS BLUE,2,2011-11-17,4.13,,United Kingdom
560772,18007,ESSENTIAL BALM 3.5g TIN IN ENVELOPE,1,2011-07-20,0.42,,United Kingdom
575917,23100,SILVER BELLS TABLE DECORATION,12,2011-11-11,1.25,13895.0,United Kingdom
552285,22604,SET OF 4 NAPKIN CHARMS CUTLERY,3,2011-05-08,2.55,14684.0,United Kingdom
572330,22652,TRAVEL SEWING KIT,2,2011-10-24,1.65,16426.0,United Kingdom
546892,22029,SPACEBOY BIRTHDAY CARD,1,2011-03-17,0.83,,United Kingdom
578290,23555,LANDMARK FRAME NOTTING HILL ,3,2011-11-23,12.5,13644.0,United Kingdom
574074,22753,SMALL YELLOW BABUSHKA NOTEBOOK ,3,2011-11-02,1.63,,United Kingdom
557027,22845,VINTAGE CREAM CAT FOOD CONTAINER,2,2011-06-16,6.35,12816.0,Poland
573155,85014A,BLACK/BLUE POLKADOT UMBRELLA,3,2011-10-28,5.95,13632.0,United Kingdom
581492,22694,WICKER STAR ,1,2011-12-09,4.13,,United Kingdom
537890,22931,BAKING MOULD HEART WHITE CHOCOLATE,6,2010-12-09,2.55,15358.0,United Kingdom
580880,72819,CUPID DESIGN SCENTED CANDLES,12,2011-12-06,1.25,14121.0,United Kingdom
570872,21739,COSY SLIPPER SHOES SMALL GREEN,1,2011-10-12,2.46,,United Kingdom
570482,21985,PACK OF 12 HEARTS DESIGN TISSUES ,1,2011-10-10,0.39,17459.0,United Kingdom
572751,22795,SWEETHEART RECIPE BOOK STAND,2,2011-10-25,6.75,17449.0,United Kingdom
570833,23112,PARISIENNE CURIO CABINET,2,2011-10-12,7.5,14834.0,United Kingdom
539434,85150,LADIES & GENTLEMEN METAL SIGN,2,2010-12-17,5.06,,United Kingdom
566969,85032C,CURIOUS IMAGES GIFT WRAP SET,12,2011-09-15,0.65,15205.0,United Kingdom
546646,22219,LOVEBIRD HANGING DECORATION WHITE ,5,2011-03-15,0.85,13716.0,United Kingdom
551727,23148,MINIATURE ANTIQUE ROSE HOOK IVORY,12,2011-05-04,0.83,14245.0,United Kingdom
558904,23348,CHILDRENS TOY COOKING UTENSIL SET,1,2011-07-04,4.13,,United Kingdom
574659,23270,SET OF 2 CERAMIC PAINTED HEARTS ,6,2011-11-06,1.45,16942.0,United Kingdom
547405,22861,EASTER TIN CHICKS IN GARDEN,6,2011-03-23,1.65,17705.0,United Kingdom
554560,85066,CREAM SWEETHEART MINI CHEST,2,2011-05-25,12.75,13317.0,United Kingdom
577980,22690,DOORMAT HOME SWEET HOME BLUE ,1,2011-11-22,8.25,16330.0,United Kingdom
C550353,51020B,STRIPY DESIGN SHOWER CAP,-1,2011-04-18,0.29,17841.0,United Kingdom
566193,22356,CHARLOTTE BAG PINK POLKADOT,10,2011-09-09,0.85,14961.0,United Kingdom
546105,21915,RED  HARMONICA IN BOX ,12,2011-03-09,1.25,14662.0,United Kingdom
567462,23296,SET OF 6 TEA TIME BAKING CASES,1,2011-09-20,1.25,14446.0,United Kingdom
567523,23089,GLASS BON BON JAR,12,2011-09-21,1.95,17034.0,United Kingdom
554917,22993,SET OF 4 PANTRY JELLY MOULDS,12,2011-05-27,1.25,15104.0,United Kingdom
550644,22993,SET OF 4 PANTRY JELLY MOULDS,1,2011-04-19,1.25,12733.0,USA
547788,84510A,SET OF 4 ENGLISH ROSE COASTERS,1,2011-03-25,2.46,,United Kingdom
566053,22620,4 TRADITIONAL SPINNING TOPS,2,2011-09-08,1.45,14410.0,United Kingdom
568553,23245,SET OF 3 REGENCY CAKE TINS,4,2011-09-27,4.95,15674.0,United Kingdom
555582,23099,FRENCH CARRIAGE LANTERN,2,2011-06-06,6.65,14312.0,United Kingdom
569469,23356,LOVE HOT WATER BOTTLE,2,2011-10-04,5.95,16360.0,United Kingdom
540418,84952A,CLEAR LOVE BIRD T-LIGHT HOLDER,1,2011-01-07,1.66,,United Kingdom
570098,23435,3 RAFFIA RIBBONS VINTAGE CHRISTMAS,10,2011-10-07,0.79,13169.0,United Kingdom
572896,21090,SET/6 COLLAGE PAPER PLATES,12,2011-10-26,0.39,12456.0,Switzerland
558628,22128,PARTY CONES CANDY ASSORTED,12,2011-06-30,1.25,12626.0,Germany
543191,21124,SET/10 BLUE POLKADOT PARTY CANDLES,3,2011-02-04,1.25,13137.0,United Kingdom
551142,84313C,ORANGE TV TRAY TABLE ,2,2011-04-26,1.95,17613.0,United Kingdom
552290,22727,ALARM CLOCK BAKELIKE RED ,1,2011-05-08,3.75,16007.0,United Kingdom
564221,21621,VINTAGE UNION JACK BUNTING,1,2011-08-24,12.46,,United Kingdom
543812,22722,SET OF 6 SPICE TINS PANTRY DESIGN,1,2011-02-13,3.95,17472.0,United Kingdom
558630,23298,SPOTTY BUNTING,6,2011-06-30,4.95,15615.0,United Kingdom
541851,22383,LUNCH BAG SUKI  DESIGN ,1,2011-01-23,1.65,17841.0,United Kingdom
546136,15056N,EDWARDIAN PARASOL NATURAL,2,2011-03-09,12.46,,United Kingdom
549017,85066,CREAM SWEETHEART MINI CHEST,2,2011-04-05,12.75,15145.0,United Kingdom
557938,23348,CHILDRENS TOY COOKING UTENSIL SET,2,2011-06-23,4.13,,United Kingdom
577061,20961,STRAWBERRY BATH SPONGE ,10,2011-11-17,1.25,14911.0,EIRE
